review,sentiment
จะออกรถโตโยต้าแบบแดงรุ่นcHrแล้วจะขอเปลี่นยล้อเป้นแลนดิกได้รีป่าวคับ,3
ฟรอ จุน เนอน์ ปี  ตีเทินได้เท่าไรคะ พูดจริงๆๆคะ,0
TOYOTA YARIS ATIV phithanbkk,0
ออนิววีออสเท่าไหร่ครับ,3
เหนว่าเอาชัสซีนินสันนาวาร่ามา,0
นิสสัน นาวารา ผลิตด้วยเทคโนโลยี่ล้ำสมัย กล้องมองได้  องศา ขับมั่นใจ  ฟรีประกันภัยชั้น  ดอกเบี้ย  พร้อมบัตรเติมน้ำมัน 5 บาท สนใจทดลองขับได้ที่ศูนย์นิสสันทุกสาขาทั่วประเทศ,0
เสี่ยจะปันใจไป Nissan แระหรอ,0
บอกตามตรงว่ารถเก๋งสวยแต่ไม่เคยชอบสายกระบะของนิสสันเลย,2
Civicพอไดุ้ mazda พอคันได้555,0
สวัสดีค่ะ หากสนใจ โคโลราโด ไฮคันทรี สตอร์ม สี Orange Crush ลูกค้าสามารถสัมผัสตัวจริงและจอง โคโลราโดสีใหม่นี้ พร้อมรับข้อเสนอพิเศษได้ที่งานมอเตอร์โชว์ ตั้งแต่ วันที่  มีค   เมย  นะคะ สามารถดูรายละเอียดเพิ่มเติมได้ที่ httpschevycom5lfy แล้วมาพบกันในงานนะคะ,0
จะเอาวีออสไปรับ 5555555,0
รถผม Dmax  Blue Power Hi lander ปี  เกียร์ออโต้ อยากยกสูงเพิ่มขึ้น  นิ้ว ต้องใส่อะไรบ้างครับ ราคาเท่าไหร่,0
ขอรายละเอียดนิสสันมาร์ชหน่อยคะ,0
เวอร์ชั่นไทย มีให้เลือก  รุ่นย่อย GA GL GLX GLX Navi เกียร์ MT ตามมาทีหลัง  สีตัวถัง  แดง น้ำเงิน ขาว เงิน เทา และ ดำ เปิดตัว  กุมภาพันธ์ นี้,0
ที่บ้านมีสวิฟแล้ว  คัน สมมุติถ้ามีเพิ่มอีกคันขอ ยาริส,0
เด่นสะดุดตา แต่คงต้องรีบเพราะมีแค่ 5 คัน เท่านั้น  Thaicarlover รถแต่ง Mitsubishi,0
ข่าวย้อนหลังมาสด้าเยอะ หลังการขายต้องปรับปรุงอีกเยอะ,2
จิ๊บๆเงินโยมเอาไปถวายพระแล้วชื้อรถแล้วมันไม่น่าหนักกะบาลใครน่ะ พระชื้อรถเบนช์มีถมเถไป แค่ซีวิคทำเป็นตื่นเต้น อย่าว่าอิจฉาพระน่ะเดียวนี้มันยุคไหนแล้ว ถ้าพระชื้อเครืองบินทนไม่ได้จะไม่ไปผูกคอตายเหรอปลงๆบ้าง,2
MG ขายได้เยอะกว่า Nissan sylphy อีกเหรอ,0
ใช้เชฟโคโรลาโด้อยู่ครับ,0
ดูเหมือนแฮชแบ้ค ดูไปดูมา เอาอีกแล้วพี่โต เอา ยาริส มาเสียบชัดๆ,2
แล้วพ่อจะให้หัดตอนกลับตจวเพราะไม่ค่อยมีรถผ่านแต่เสียวลงคลองมากขอรถที่ไม่ใช่ฟอร์จูนเนอร์ได้มั้ยกลัวใจตัวเอง,2
ติดสายถามไหม่อันติสสีขาวครับ,0
ทำตั้งแต่แรกนี่กิน isuzu ได้เลยนะเนี่ย,0
รอหน่อยนะมาสด้า ขอเก็บตังค์แป๊ป,1
เอารถเข้าศูนย์ toyotaก็มีโขมยน้ำมัน จับมันไม่ได้ อืม,2
ม่ายไหวๆจิงๆ 5555 เอาแอคคอร์ดที่ยอดขายเน่าในเมกา มาจับทุบหน้าทุบตูด ทำไมฮอนด้าออกแบบล้าหลังไงไม่รุ้ ชอบฮอนด้ามาตลอดนะ แต่มันไม่สวยจิงๆอ่ะแล้วแต่คนชอบละกันคับ,2
ป้ายแดงก้อแค่ยาริส นึกว่าBMW,2
ใหม่นิสสันนาวาร่ากับก้องรอบทิศไร้กังวลเลยแบบนี้,2
รถผมรีโว่เปลี่ยนน้ำมันเครื่องรุ่นเก่าให้เฉยเลย,2
ชุดค้ำนิรภัย Ultra Racing ตรงรุ่น Toyota CHR ล๊อตแรกของโลก ชุดแรกในไทย ท่านเจ้าสำนัก ศูนย์บริการรถยนต์ครบวงจร Hybrid AutoCar รังสิตคลอง  จัดไปครบทุกจุดแล้ว หน้าบน  แพล่าง ชุดเต็ม รอชมรีวิวครับ  CHRใครได้รถแล้ว อยากนิ่ง แน่น หนึบ ติดต่อไปเลยคราบ,0
ขอรายละเอียด โน๊ตกับอัลเมร่า ได้ไหมคะ,0
ขอคำแนะนำหน่อยครับ ยาริสเราใส่แม๊กขอบอะรัยดี ครับ,3
ถูกศูนย์ Honda กำแพงแสน จนครปฐม ย้อมแมวรถไม่ตรงรุ่นและไม่ยอมรับผิดชอบให้ฟ้องศาลเองใครซHondaรถยนต์,2
ชิ้นส่วน B หายไปค่ะ อยากเอารถ honda jazz มาเข้าสินเชื่อกับทาง Quick Leasing ค่ะ ควิกลิสซิ่ง อนุมัติไว รับเงินไว ยังไงก็พึ่งได้,0
ขออนุญาติแท็กนะฝากบอกแชร์ต่อให้หน่อยนะค่ะ ออกรถ กับทางฮอนด้าพระราม  สาขาพระประแดง ตั้งแต่  มกราคม 5 พบกับ แคมแปญเดือนมกราคม  กับฮอนด้าช่วยผ่อน สำหรับ jazz city brv mobilio hrv เดือนละ  บาท  เดือน มูลค่า  บาท สำหรับ crv ฮอนด้าช่วยผ่อนเดือนละ  บาท  เดือน มูลค่า  บาท สำหรับ accord รับฮอนด้าช่วยผ่อนเดือนละ 5 บาท  เดือน มูลค่า  บาท สำหรับ accord hybrid รับฮอนด้าช่วยผ่อนเดือนละ  บาท  เดือน มูลค่า  บาท พร้อมของแถม ฟรีประกันภัยชั้น   พรบ ฟิลม์นิรภัย AESTOMA รับประกัน  ปี ป้องกันการโจรกรรม ปาหิน ทุบกระจก กรีดกระจก และที่สำคัญคุ้มครองเข้าประกันภัยรถยนต์ ราคารวมยอดจัดผ่อนสบายๆ นำรถเก่ามาเทินกับเราให้ราคาสูงแถมยังได้บัตรของขวัญ  บาท ติดปัญหาไฟแนนซ์เราช่วยคุณได้ โปรดีแบบนี้มีที่ไหนที่นี่ที่เดียวที่ ฮอนด้าพระรามสามสาขา พระประแดงเท่านั้น มาเป็นครอบครัว HONDA กับเรานะค่ะ สนใจทักมาได้ค่ะ ชลินี จิน ID  jinnyjin,0
ลิตร ของ Raptor เรียกพลังได้ 5 แรงม้า 5 นิวตัน โหดจริงๆ ทีแรกนึกว่า เครื่องนิสสันจะได้  แล้วนะ,0
TOYOTA FT    มุมนี้ อย่างหล่อ,1
เสียใจที่ไม่มีรูปถ่ายกับรถ เป็นรูปเห็นท้ายรถแทนละกัน จะบอกว่ารถคันนี้เป็นรถคันแรก ชอบมาก เพราะขับแล้วคล่องตัว จอดในห้างสบายๆ ผมเป็นคนตัวเล็ก เลยชอบขับ Jazz ของผมเป็น Hybrid ประหยัดน้ำมันมาก แซงซ้ายขวา อย่างมั่นใจ เคยรถน้ำมันหมดกลางทาง Honda ก็มาเติมให้ อุ่นใจมากครับ รักและขอเป็นครอบครัวฮอนด้าไปตลอดเลยครับ ฮอนด้าที่รัก EnjoyHondaThailand,1
อยู่ที่อู่รึเปล่าครับ มาสด้าคันเก่าผมโดนชนท้าย ก็แค่วันเอง อู่นอก ปนะ,0
เผยโฉม นี่คือ Toyota Corolla Altis  เวอร์ชั่น 5 ประตูสำหรับตลาดยุโรป,0
suzuki new model ที่เปิดตัวล่าสุดในงาน Motor show   รุ่น Sv5x abs ทายผลการแข่งขัน BG พบ Police Taro  บีจี    โปลิสเทโร,0
ออกรถยนต์ฮอนด้าวันนี้ รับข้อเสนอสุดพิเศษ ดอกเบี้ยต่ำ พร้อมฮอนด้าช่วยผ่อนนานถึง  เดือน ตั้งแต่วันนี้   เมย  ที่โชว์รูมกระบี่ฮอนด้าทั้งสาขา รายละเอียดเพิ่มเติม คลิก,0
โอ้ยยเสียดายเอาเงินไปจองรถหมดล้าววววันนี้,2
แค่ผู้หญิงขับวีโก้,0
CHRรวมเทคโนโลยีสกายไลน์ของ cx หรือยังตอนนี้ ตอนนั้นเห็นมีข่าวจับมือกันกับมาสด้าและโตโยต้า แบ่งปันเทคโนโลยีกัน,0
ฮอนด้า ซีวิค แฮทช์แบ็ก ใหม่คือคันที่นับจากซ้ายมือคอลัมน์ที่ แถวที่ 5 ค่ะ,0
ลูกสูบของวีออสไม่ได้ออกแบบมาเพื่อติดแก้ส lpg ก็มีคนเอาไปติดแก็สไม่เกินปีลูกสูบมีปัญหาแน่นอน แต่โคโรลล่า เขาออกแบบมาเพื่อติดแก็สได้ มีทั้งติดตั้งที่โรงงานเลยและติดตามข้างนอก ถ้าเอาviosไปติดหมดประกันศูนย์แน่นอน ราคาซ่อมและเปลี่ยนลูกสูบก็หลายหมื่น แต่โคโรล่าเขาเกิดมาเพื่อสิ่งนี้,2
ว่าจะสั่งมาลอง แต่นิสสันเทียน่า j กดซวิตส์ on กดคันเร่งแล้วลิ้นไม่เปิด ทำไงได้บ้างคับ ไม่งั้นมันล้างได้ด้านเดียว,0
สวยพอไหม ภาพร่าง Toyota Altis  ใหม่ โดยนักออกแบบอิสระ จับเอาหน้า Auris มาใส่ตัวถังซีดาน,0
ยาริสปีไมค์ต้องทำการเปลี่ยนอะไรบ้างครับ,3
All new Almera พองลม,0
ผมได้จอง CX5 หลังจากเห็นข่าวการฟ้องร้องลูกค้า ผมก็ย้ายไฟแนนซ์ไปซื้อฟอร์จูนเนอร์ทันที ประกับกับ Mazda ดีเซลผมก็ยังซ่อมไม่หายเลยไม่ขอเสี่ยง,0
ชม Nissan GTR เครื่องยนต์วางกลางในจินตนาการ,0
สามารถดูราคา MG GS ในเว็บไซต์ตามลิงค์นี้ได้เลยครับ  httpmgcarscomthmgmodelsmggsdetailprice,0
ได้รุ่นซื้อขายเลยครับนานๆไปขาย Yaris รุ่นปลา กระโห้ ครับ สำหรับเต็นท์มือสองเรียกได้เลย55555,0
X trail หรือ Rogue รถ suv ที่ขายดีที่สุดในโลก แต่ nissan ไทยดูเหมือนไม่อยากจะขาย เปิดตัวก็ช้า การตลาดงงงวยมาก,2
รุ่นนี้ราคามือสองไม่กี่แสน ถูกกว่าอัลติสอีก,2
เว่าอิสานให้ฟังแหน่ ToyotaBuzz MOTORSHOWยกมาที่นี่,0
ไปทำมาขนาดนี้ จากเดิมแค่5ม้า ไปทำมาซะเยอะ 5ม้า แต่นาวาร่าเดิมๆ ไม่ต้องไปแต่งอะไรก็จัดมาให้ม้าครับแบบไม่ต้องดิ้นให้เหนื่อย เครื่องไปทำมาแล้ว มาเกทับผมว่ามันตลกครับ จริงๆห่างกันแค่5ม้า ตามหลักทฤษฎีแล้วแทบไม่รู้สึกถึงความต่างเลยครับ รถผมเสียเงินซื้อมาได้รถที่พร้อมใช้งาน แต่รถคุณรถตลาดค่าตัวที่แพงกว่า แต่ต้องต้องจ่ายค่าของแต่งเพิ่มอีกหลายรายการเพื่อที่จะว่าให้วิ่งทัน แล้วบอกไม่ต้องทำไรมาก เปลี่ยนกล่องใหม่ เปลี่ยนเทอโบใหม่ เปลี่ยนแคมใหม่ ท่อก็ต้องเปลี่นทำมาขนาดนี้ถ้าบอกไม่เปลี่ยนก็เสียเวลาเปล่าถูกมั้ยครับ จากรถที่ได้ชื่อประหยัด คงไม่ประหยัดซะแล้วละครับ ถ้าคนเค้ามีความคิดที่เป็นกลาง เค้าก็คงรู้แล้วครับว่าค่ายไหนหน้าใช้กว่ากัน ขอโทษสมาชิกด้วยครับที่เขียนเยอะ แต่ผมฟังเค้าตอบแล้วตลก และขัดความรู้สึกมากครับ,2
ปกตินั่งแต่มิวเอ็กจะเหยียดขายังไงก็ได้พอมานั่งซีวิคแล้วแปลกๆหัวก็ไม่ได้ติดนะแต่รู้สึกรถคับแคบไปหมดเลย,2
มีบัตรเข้าชมมอเตอร์โชว์ ที่อิมแพคเมืองทองแจกมั้ยคะ สนใจ ชม รถ Honda ในงานค่ะ,0
ผู้บริหาร Nissan แผนก LCV ยอมรับว่า พวกเขากำลังศึกษาความเป็นไปได้ที่จะพัฒนากระบะตัวดุ เพื่อแข่งกับ Ford Ranger Raptor แต่ปัญหาคือ พวกเขาต้องเฟ้นหาเครื่องยนต์ที่เหมาะสมกับกระบะคันนี้เสียก่อน,0
ฮอนด้าไม่ให้ทำแท็กซี่นาจาา เคยมีคนเอามาทำพักนึงฮอนด้าซื้อคืนเลยค้า,0
ไปขับรีโว่เทียบดีแมก ตัดสินใจถอยรีโว่ทันที ทั้งที่ตอนแรกผมว่าดีแมกสวยกว่า 555,1
คุณเคยได้ยินเกี่ยวกับมาสด้า  ดีเซล เครื่องยนต์สั่นที่ความเร็ว km ตามด้วยไฟรูปเครื่องโชว์หรือไม่ ตอนนี้เราสามารถสัมผัสมันได้เป็นครั้งที่  ในรอบไม่ถึง  ปี เราควรทำอย่างไรเพื่อลดการเสี่ยงตายบนถนนที่อาจเกิดจากรถเป็นสาเหตุ่,3
กำลังมองมาสด้า  อยู่ ใครมีประสบการอะไรบ้าง,0
เชิญสัมผัสและทดลองขับ ISUZU DMAX และ THE NEW ISUZU MUX พร้อมเงื่อนไขสุดพิเศษ ในงาน Bangkok International Motor Show ครั้งที่  วันที่  มีค เมย  ณ ชาเลนเจอร์  อิมแพค เมืองทองธานี,0
ฮุนได ยืนยัน เตรียมรถสปอร์ตไฮบริด  ประตู has been published on,0
รุ่นนี้มันออกแบบไฟมาให้แยงตาพอดีเชียว แสบตามาก Fortuner toyota bad dosomething BMW,2
ตอนแรกคิดจะซื้อรถFortunerขี่แต่พอมามีข่าวว่านักค้ายานักเลงและพวกค้าของถื่นใช้กันจนเป็นข่าวเลยไม่กล้าซื้อเลยกลัวถูกคนเขามองอายไม่กล้าใช้แล้วขี่CAMRYดีกว่าสุภาพดีไม่มีข่าว,0
พวงแบบนี้ถ้าอยู่ในนิสสันจะถูกล้อว่า ทรงมดลูก แต่พอมาอยู่ toyota ไม่เห็นว่างัยเลยเนาะ,0
ฮุนได ส่งรถไฟฟ้า ไอโอนิค และ เอชวัน แบล็กซีรีส์ รุ่นแต่งพิเศษ เปิดตัวพร้อมจำหน่ายในงานมอเตอร์โขว์ Autoworldthailand Hyundai HyundaiHBlackSeries HyundaiIonic NewCars มอเตอร์โชว์ รถใหม่ ฮุนได ฮุนไดไอออนิค เอชวันแบล็กซีรีส์ มอเตอร์โชว์,0
อยากทราบว่าคุณจิมมี่มีคิวทดสอบอัตราเร่งอัตราสิ้นเปลือง Mazda CX5 SP เมื่อไหร่ครับ,3
ปกติพ่อจะเอาดีแมกไป แต่วันนี้แย่งรถแจ๊สแม่ไป ไม่ได้ขับนานลืมแล้วว่าขับยังไง จริงๆไม่เมาขนาดนั้น เพราะตอนเช้าเรียกกูไปถามอยู่ว่าทำไมใส่เกียร์ไม่ได้ 555 พ่อไม่เหยียบเบรก,2
ใช้ฮอนด้าHRV ขึ้น ตอนขึ้นอ่างขางทางโหด สัญญาณไฟเตือนตรงพวงมาลัย เริ่มใจเสีย ไม่รู้ว่าเตือนอะไร ลุ้นตลอด กลัวรถมีปัญหา,2
ผมเป็นติ่ง honda แต่เหนรุ่นนี้บอกคำเดียวว่า ใครซื้อ HRVตัวท๊อปมา ถือว่า พลาด,2
ฮอนด้า เหนือขั้น เปิดตัวฮอนด้า คอนเนค,0
เปลี่ยนน้ำมันเครื่อง นิสสันนาวาร่า เท่าไหร่ค่ะ,0
ที่สมุย ฟอร์จูนเนอร์ Mu X และรถ PPV ต่างๆเป็น Taxi เพียบเลย,0
เครื่อง  ออกโต้ ไม่เคยติดแก๊ส รถสวย แนนซ์GE ราคา 5 ลึก,0
ข้าขอเลข เจ้าคะ etoyotaclub etoyotaclub toyotachr etoyotaclubเอโตะคุงเสี่ยงทาย toyotachr toyotathialand,0
ใช่ครับ ระบบนี้ในเชฟtrailblazer ตัวใหม่ ก็ให้มาเหมือนกัน แต่ของPajero จะเตือนตื้ดๆๆๆ ถ้ายังไม่เบรกอีก ก็จะเบรกให้เลยครับ,0
โตโยต้าอัลติสได้รวมรถแท็กซี่ด้วยหรือปล่าวครับ,0
MG ครับวัยรุ่นๆ ต้องรุ่นนี้ครับ น่ารัก สีสันสดใส ขับไปไหนก็มีแต่คนมองครับบ MGCarsTH PassionDrives,1
ไฟecoจะดับลงก็ต่อเมื่อความเร็วรถอยุ่ที่ขึ้นผมใช้ยาริสอ่านในคุ่มือครับ,0
ครับ โดนเฉพาะ celerio ปังมาก,1
มิตซูบิชิ ปาเจโร สปอร์ต ลิมิเต็ดอิดิชั่น สัมผัสความหรูหราสะท้อนภาพผู้นำ กับห้องโดยสารโทนสีเบจ ในสไตล์เปียโนแบล็ก เบาะที่นั่งแบบ Ergo Seat Design สะดวกสบาย โอบรับทุกสรีระ มาพร้อมเทคโนโลยี ที่จะช่วยสร้างอากาศบริสุทธิ์ตลอดการเดินทาง สนใจโทร 555,0
มาสด้า  ดีเซล เขาว่าโคตรประหยัด สุดๆ,1
รีโว่ เนี่ยนะหล่อ,2
ฝาสูบโก่ง หม้อน้ำดัน เห็นมาหลายคันเเล้วน่ะครับ cx5กับ mazda,2
รถปิคอัพ ยี่ห้อ Nissan เป็นรถที่มีคุณภาพ รูปทรงสวย สมรรถนะการขับขี่ปลอดภัย ค่ะ,1
สนใจ mg ค่ะ โชว์รูมอยุ่แถวไหนคะ,3
คำฟ้องมาสด้า กับจำเลยที่เป็นผู้จัดการบริษัทน้ำมันตามข่าว  ช่วยไขความกระจ่างระหว่างมาสด้า กับลูกค้าได้  ต้องอ่าน,0
