neu,🚗💨💨 ซิ่งเป็นบางเวลา ซ่อกแซ่กได้ทุกที่ << ขับสนุก ชับมัน ใช่เลย‼️ 👍🏻👍🏻 Honda Jazz>>#Jazz Naja
pos,สนใจ ฟอจูนเนอร์ สีขาวครับ
neg,Nissan คงใกล้จบแล้วแน่ๆ
neu,สุดเท่กับชุดแต่ง RS มาพร้อมภายนอก... สปอร์ต ดุดัน และเทคโนโลยีเพียบ !! #Thaicarlover #Chevrolet #CruzeRS
pos,"แดงโดนใจจริงๆ 😲 Honda Civic Hatchback Rallye RED ลุยงาน #MotorShow2018 หลังจากที่เคยเปิดตัวในรุ่นซีดาน . มาพร้อมระบบสตาร์ทเครื่องยนต์แบบอัจฉริยะ (One Push Ignition System) แค่เพียงกดปุ่ม Start เครื่องยนต์ 1.5 ลิตร เทอร์โบ ของ Honda Civic RED Turbo RS ก็พร้อมจะไปกับเราในทุกเส้นทาง . ราคาค่าตัวอยู่ที่ 1,169,000 บาท . ใครสนใจไปพบตัวจริงกันได้ที่บูธ A9 อาคารชาเลนเจอร์ฮอล์ 1-3 อิมแพค เมืองทองธานี"
neu,"ผมเคยถามคนขับแท็กซี่มาแล้วครับ แกบอกมาแบบนี้นะ โตโยต้าที่นิยมเอามาทำแท็กซี่เพราะเค้ามีโควต้าให้คนซื้อรถที่จะเอามาเป็นแท็กซี่ครับ ถูกกว่าขี้หมูขี้หมาก็คันละ 200,000 ในขณะที่ฮอนด้าก็ไม่ได้ห้ามแต่เค้าขายราคาปกติครับจะซื้อมาทำแท็กซี่ก็ต้องจ่ายเหมือนกับคนอื่น เหตุนี้จึงทำให้ไม่นิยม ส่วนเรื่องอะไหล่กับความคงทนผมว่าไม่ใช่ประเด็นอ่ะถ้ารถมันพังง่ายขนาดนั้นคงขายไม่ได้หรอก คุณภาพรถญี่ปุ่นผมว่าก็พอๆกันน่ะแหละประเด็นคือเรื่องราคาตามที่พี่แกว่ามากกว่า"
q,นิสสัน suv ที่เพิ่งเปิดตัวที่ฟิลิบปินส์เป็นไงบ้างครับ สมรรถภาพ มาไทยเมื่อไร
neu,toyotaกับhondaต่างกันตรงการซ่อมบำรุงราคาซ่อมที่ต่างกันน่าจะจุดเลือกที่นิยมtoyotaมากกว่าแต่ถ้ามีเงินซ่อมบำรุงรถก็จบสำคัญที่สุดอยู่ที่ความต้องการของเจ้าของรถ
neu,ขอบ 18 ใส่ xtrail เท่ารัยครับ รับเทรินขอบเก่าด้วยมั้ยครับ มีขอบ 20 เลนโซอยู่ครับ
neg,ช็อคที่ 1 Benz ขึ้นอันดับ 5 ชนะ มิตซู นิสสัน ฟอร์ด ช็อค 2 MG มาแรงมาก ช็อค 3 เข้าไปดู BMW ติดที่ 11 ปล chev หายสาบสูญ อันนี้ไม่ช็อค
neu,นิสสันโน๊ตครับ
neg,นี่นิสสันยังดูไม่ใหญ่อีกเหรอครับ..ส่วนตัวคิดว่ารถกระบะนิสันออกแบบดูเทอะทะกว่าค่ายอื่นในยุคเดียวกัน(แต่ดูตัวเลขแล้วก็ไม่ได้ใหญ่นะ)ถ้าเขาเดินเกมแบบค่ายเจ้าตลาดทั้ง2ค่ายหรือออกตัวเท่ๆแบบฟอร์ดน่าตะไปได้ดีกว่านี้(ฟอร์ดยังไม่ใข่แรปเตอร์นะแรปเตอร์ส่วนตัวว่าแรปเตอร์เป็นปิคอัพหรูน่าจะเฉพาะกลุ่มที่เงินถึงๆ)
neu,(‘GET 102.5’ ร่วมสร้างปรากฏการณ์เรืองแสงสุดยิ่งใหญ่ เอาใจคนรักสุขภาพ ใน ‘HONDA GET GLOW RUN’) http://www.jiggaban.com/97024-get1025-4/ ‘GET 102.5’ ร่วมสร้างปรากฏการณ์เรืองแสงสุดยิ่งใหญ่ เอาใจคนรักสุขภาพ ใน ‘HONDA GET GLOW RUN’ ​กลับมาอีกครั้งกับงาน “HONDA GET GLOW RUN” มหกรรมวิ่งเรืองแสง ณ สะพานพระราม 8 ที่จัดโดย “คลื่น GET 102.5” บอกได้คำเดียวว่า ครั้งนี้จัดเต็มยิ่งใหญ่อลังการกว่าเดิม รวมพลนักวิ่งทั้งมืออาชีพ และมือสมัครเล่นกว่... ‘GET 102.5’ ร่วมสร้างปรากฏการณ์เรืองแสงสุดยิ่งใหญ่ เอาใจคนรักสุขภาพ ใน ‘HONDA GET GLOW RUN’ ​กลับมาอีกครั้งกับงาน “HONDA GET GLOW RUN” มหกรรมวิ่งเรืองแสง ณ สะพานพระราม 8 ที่จัดโดย “คลื่น GET 102.5” บอกได้คำเดียวว่า ครั้งนี้จัดเต็มยิ่งใหญ่อลังการกว่าเดิม รวมพลนักวิ่งทั้งมืออาชีพ และมือสมัครเล่นกว่
neu,แม้ว่า Nissan Maxima และ Murano ในปัจจุบันทำยอดขายดีขึ้นกว่ารุ่นเดิมแค่ระดับหนึ่ง แต่ในจีน Maxima กลับล้มเหลว Murano แค่พอไปได้ นี่อาจจะเป็นเหตุผลหลักที่ทำให้การปรับโฉม Minorchange ต้องดูสง่างามขึ้น
pos,นิสสันโน๊ต รถประหยัดน้ำมัน ราคาเบา ดีไซร์เลิศ ขับขี่ดีมากๆ ใครๆก้อชอบ มีหลายสีให้เลือกด้วยครับ
neu,พลาดเพราะรีโว่นั่นแหละ
neg,ถ้าทำประตูเปิดเหมือนRX8 เจ้า CHR จะเป็นผู้บุกเบิกรถทรงนี้อย่างเต็มตัว..เพราะมันจะเข้ากับบุคลิกรถแคปทึบสปอร์ต..น่าเสียดาย
neu,วันนี้นะ ที่ลานโตโยต้า คุณวาสี ถนนชัยภูมิ-บ้านเขว้า
neu,ชาวกรุงตื่นเต้น รถบ้านสุดฮิป U Motel ที่ถูกเนรมิตขึ้นมาจาก U Beer #SleepWithU #UMotel อย่าลืมติดดาวเพจ https://www.facebook.com/UBeerThai/ เพื่อไม่พลาดเรื่องราวและกิจกรรม
neu,"Civic ทุกรุ่นใช้ระบบกันสะเทือนหน้าแบบคอยล์สปริง ด้านหลังทอร์ชั่นบาร์พร้อมคอยล์สปริง เครื่องยนต์ยังคงใช้รหัส D และเพิ่มรุ่นใหม่ 1,500 ซีซี CVCC โดยในปี 1984 ได้เพิ่มรุ่นแรงรหัส Si สำหรับทำตลาดญี่ปุ่น ปรับปรุงระบบกันสะเทือน และใช้เครื่องยนต์ DOHC ZC ความจุ 1,600 ซีซี กำลังสูงสุด 130 แรงม้า ส่วนรุ่นที่ทำตลาดในสหรัฐอเมริกาในชื่อ Civic Si 3 ประตู และ CRX Si ใช้เครื่องยนต์หัวฉีด 12 วาล์ว กำลังสูงสุด 91 แรงม้า เดือนพฤศจิกายน 1984 ฮอนด้าเพิ่มระบบขับเคลื่อน 4 ล้อให้ Civic เป็นครั้งแรกในรุ่น Shuttle ช่วงแรกมีปุ่มกดสำหรับเข้า-ออกจากระบบขับเคลื่อน 4 ล้อที่เรียกว่า ""Realtime"" เพราะสามารถทำได้ขณะรถวิ่ง จากนั้นในเดือนกุมภาพันธ์ 1985 จึงเพิ่มรุ่น Quint Integra ตัวถังแฮทช์แบ็ก 3 ประตู ฐานล้อ 2,450 มิลลิเมตร และในเดือนพฤศจิกายน 1986 เพิ่มรุ่น 5 ประตูแฮทช์แบค พร้อมขยายขนาดฐานล้อเป็น 2,520 มม."
pos,Nissan X-trail ขับนิ่ม เสียงเงียบ สบาย คล่องตัว
neu,Nissan Note. ดาวน์เท่าไรค่ะ
pos,น่าสนใจค่ะMGเป็นรถที่ออกแบบเพื่อความปลอดภัยรูปแบบทรงสวยทันสมัย
neu,เผยรถต้นแบบ Small Rs Concept ที่คาดว่าจะเป็น All New Honda Brio รุ่น RS
neu,เขานั้นขี่ ฮอนด้าแจส มาจีบเจ้า พี่นั้งเศร้า ข้างฟีโน่ โง่เหมือนหมา ชีวิตพี่ วันวัน นั้นไปนา ส่วนแก้วตา จับปากกา ในห้องแอร์
neu,: รหัสตัวแรงครั้งแรกใน SUV ของค่าย มากับเครื่องยนต์เบนซิน 2.7 EcoBoost เทอร์โบคู่ 335 แรงม้า 515 นิวตันเมตร เกียร์อัตโนมัติ 8 จังหวะ ขับเคลื่อน 4 ล้อ
neu,มาสด้า3ดาวกี่บาทคับ
q,มองว่าไงถ้าเทียบกับ HRV และ Subaru XV
neg,ตอนแรกอยากได้ jazz ไปๆมาๆ แม่บอก พ่อขับไม่มรถมันเล็ก เอาคันที่ขับได้ทั้งครอบครัว จบที่ civic จ้า งงๆไปอีก
neu,#รถในฝัน! อยากได้จัดให้.. โตโยต้า ใจป้ำมอบรถในฝันโตโยต้าฟอร์จูนเนอร์รุ่นท็อปราคา 1.7 ล้านให้ศรีสะเกษ 1 คัน กำหนดมอบวันเสาร์ที่ 3 มี.ค.นี้ที่ค่ายนครหลวงโปรโมชั่น
neu,ซื้อแจสขับดีก่าแบบนั้ย
neg,6-7 แสนให้ออกวีออส เหรอ ผมคนหนึ่ละไม่เอาแน่ เอาเงินไปซื้อ เบนซ์ E220 cdi มือ2 ปี 2004 -2008 มาขับดีกว่า ครับ
neg,ในขณะที่ Mazda Thailand ส่งหมายเรียกลูกค้า... ให้ไปขึ้นศาล ในฐานะจำเลย พร้อมเรียกร้องให้ชดใช้ 95 ล้านบาท ทั้งๆที่เหตุเกิดจากรถที่ตัวเองขายนั้นไม่ได้มาตรฐาน และเกิดปัญหา ผมเพิ่งเป็นลูกค้ามาสด้าได้ครึ่งปี... ซื้อ mazda 2 ดีเซลตัวท็อป กำลังจะผ่อนหมดในอีกไม่นาน และเคยคิดว่าจะซื้อ cx-5... แต่ตอนนี้ไม่แล้ว คงบ๊ายบายค่ายนี้อย่างจิงจัง เพราะไม่นึกว่าผู้บริหารจะกระทำการที่ไร้สามัญสำนึกได้ถึงขนาดนี้ ขนาดฟอร์ด... เค้าโดนร้องเรียนเรื่องเฟียสต้ามาขนาดไหน... ถึงจะแก้ปัญหาไม่ได้แต่ก็ไม่เคยมาฟ้องร้องลูกค้า... ความคิดพวกคุณนี่แม่งโคตรสกปรกเลย
neg,พี่เขยผมจะเอารีโว่แต่ไม่ผ่านแนน เลยเอาดีแมกแทน
q,ขอสอบถามเซลล์โตโยต้าหน่อยครับผม Toyota Yaris รุ่น Top ตอนนี้มีส่วนลดหรือของแถมอะไรได้บ้างครับ
q,ปิคอัพ โตโยต้า ไทเกอร์ แคป ราคาเท่าไหร่คับ
neu,นิสสันโน๊ต ดาวน์เท่าไรคะ
neu,รอ MG6 ตัวใหม่ อย่างหรู
neu,นี่แหละครับรถที่ใช่ ... คันที่อยู่แถวที่ 5 (นับจากแนวนอน) คอลัมน์ที่ 4 (นับจากซ้ายไปขวา)คือ ฮอนด้า ซีวิค แฮทช์แบ็ก ใหม่แน่นอน #EnjoyHondaThailand
neu,"เพิ่มแรงม้า ทางฝุ่น ลุยน้ำ ผ่านได้สบาย สนอร์คเกิลไอรอนแมน ISNORKEL050 Mitsubishi New Triton 2015+ ‘Ironman 4x4 Always with you ไอรอนแมน อยู่กับคุณทุกช่วงเวลา’ ""Ironman 4x4 ประสบการณ์ช่วงล่าง 60 ปี ไปได้ทุกที่พร้อมๆกับการท่องเที่ยวของคุณ"" 2018 60Years Ironman 4x4 Suspension together with your travel !"
neg,รบกวนถามคับ..ตอนนี้ผมใช้รีโว่2.4เป็นรถห้องเย็นผมรุสึกว่ารีโว่ซดกว่าแชมป์มากๆ..ผมเคยขับแชมป์มาก่อน..และมีคนแนะนำว่าให้เราไปจูนกล่องECUใหม่จะให้ประหยัดขึ้น..อันนี้จริงเท็จประการรบกวนขอความรู้เพิ่มเติมครับ..แล้วมีข้อดีข้อเสียอะไรบ้างครับ
pos,รักนิสสันครั้งหนึ่งชนกับแท็กซี่ๆเละเลยนิสสันไม่มีรอยเลยคนในรถปลอดภัยทุกคน
q,ขอรายละเอียด yaris ค่ะ
neu,เมื่อไหร่จะเอาแอคคอร์ด2018เขาไทยซะที?
neg,ดูความเร็วทางตรงอย่างเดียวไม่ได้จริงๆ ครับต้องดูความเร็วทางคดเคี้ยวด้วย jazz vios อาจแหกไปก่อนตั้งแต่โค้งแรกแล้วก็ได้
neu,นิสสัน เตรียมเปิดตัว จีที-อาร์ เจ้าของตำนานซูเปอร์สปอร์ตคาร์ อย่างเป็นทางการ ครั้งแรกสำหรับประเทศไทย ในงานมอเตอร์โชว์ ครั้งที่ 39 http://acarnewsonline.com/carbusiness/nissan-gt-r-2018
neg,เป็นคนเรียบๆ ง่ายๆ ไม่ชอบสีสันเยอะค่ะ เลี้ยงง่ายด้วยนะ สนใจเลี้ยงข้าวสักมื้อไหม ?#กลมกลืนมากกกกก #55555+#น้องเพชรชมพู#nissan #note #baeng_priklao #แบงพริกลาว
neu,สำหรับนิสสัน โน๊ต สามารถคลิกอ่านได้ที่ https://www.nissan.co.th/offers/nissan-note.html
neg,เครียดสุดก็ค่าน้ำมันกะค่าทางด่วนนี่แหละ โดนแม่ผลัก camry มาให้ขับ คือแบบ แก เงินเดือนเด็กจบใหม่ จ่ายค่าน้ำมัน camry…
neg,คนบ่นไม่ซื้อ คนซื้อไม่บ่น เจาะความแพง FORD RANGER RAPTOR: บ่นกันเยอะเรื่องราคาที่แพงแสบตับ…
pos,ไครว่าสี Honda บางมั้งคับโดนหินดีดนิดเดียวแม่งลอกเป็นแผ่นเทียบกัน nissan almera อีกคันที่บ้านใช้มา 5 ปีไม่มีแม้กระทั้งรอยหินดีด
neu,แล้วแต่จะมองครับ เพราะต้องรอดูการปรับจูนหน้างานอีกรอบว่า ออกจากศูนย์เป็นยังไง อัตราเร่ง/น่ำมัน/ความทน แต่ถ้าเทียบกับเครื่องเดิมๆ ยาริสกินขาดเรื่องเครื่อง ส่วนมาสด้า2ได้แต่ประหยัดน้ำมัน เครื่องตัวนี้คงต้องรอดูเทสไดร์/รีวิวอีกที ถ้าเครื่องเดิมเกียร์เดิม ผมว่าเป็นรอง
neu,#เริ่มแล้วนะคะ🎉🎉 👉งานเปิดตัว All New Suzuki Swift 2018 สปอร์ตคอมแพ็กคาร์มาตรฐานระดับโลก😍😍 👉ที่โชว์รูมกิจตรงออโตโมบิล ซูซูกิอุบลราชธานี (ห้วยคุ้ม)ทางไปอำนาจเจริญ 😛 #มาร่วมงานกันเยอะๆนะคะ 😍😍 👉ติดตามดูไลท์สดได้ที่เพจนะค่ะ📸📺📷
neg,คล้ายๆ yaris ใหญ่กว่านิดนึงแต่ด้านหลังอึดอัดมากแคบด้วยไปดูมาแต่สวย
pos,All-New Toyota RAV4 เตรียมเปิดตัวที่นิวยอร์กปลายเดือนมีนาคมนี้
neg,พอพูดถึงรถยนต์แล่วคิดถึงแฟนเก่าเลยค่ะ อิสัส ออกมาสด้า2มาให้กูนั่งเป็นตุ๊กตาหน้ารถได้3เดือน ไล่กูลงรถเฉยจ้าาาาา ไม่…
neu,ราคานี้ คงจะขายยาก เพราะซื้อ คัมรี่ ได้ถึง 2 คัน
neu,เหมือนรีโว่เลยครับ
neu,กุญแจ นิสสันมาร์ช สั่นเลยทีเดียว
pos,ราคานาทีทองNissan Teana 200xl ปี2011
neg,จะเอาแรงไปไหนครับเครื่อง ลัมโบเมืองนอกขี่ในเมืองได้แค่60 นอกเมือง90 ทางไฮย์เวย์120 ได้ยินแต่เสียงท่อ แต่ก็ไปถึงที่หมาย พอๆกับวีออส
neg,ต้องสมัครพันทิปไว้แล้วล่ะ รออ่านดราม่า mazda 2 ของนี่กับศูนย์ได้เลย
neu,นาวาร่าเทียบดีแม็ก
neu,Toyota Altis มีขนาดเล็กที่สุด
neg,ออกแบบได้ลงตัวมาก ภายในสวยหรูดี ปุ่มไม่เยอะจนตาลาย... เครื่องยืดหนุ่นแรงม้าได้แบบนี้ขับมันส์ ทั้งประหยัดด้วย เยี่ยม.. ราคาล่ะคราวนี้ ถ้ากดลงมาได้สัก ล้านสองกว่า ตัวเริ่มต้น ยันล้านหก ผมว่ามีอนาคตแน่ๆ เพราะ คู่แข่ง ทั้งแคมรี่ แอคคอร์ด ไม่ประทับใจเลย
neu,555555555 อาจจะรีจิสเต่อตัวเองลงแอพ เวลาใครต้องการ เหยีบพรีอุสไปเลย 🤣🤣🤣🤣
pos,ชุดแต่งส่งตรงจากโรงงานของ Nissan Titan ที่หล่อขึ้นเป็นกอง!! แถมใส่ง่ายใช้เวลาติดตั้งไม่ถึง 4 ชั่วโมง!!
pos,ชื่นชอบcivicตลอดกาลโฉบเฉียวทุกการขับขี่หลงรักเลย
neu,สวยกว่าแคมรี่
neu,มีของนาวาร่า D40 ไหมคับ
neg,Dmax G1 ที่บ้าน 15 ปีเครื่องเดิมๆไม่เปลี่ยนไม่เคยมีปัญหา ซื้อใหม่อีกคันสงสัยคงต้องเอา Dmax กลับมาพิจารณาใหม่
pos,ต้องยอมรับเลย Dmaxโฟกัสได้ตรงจุดผู้บริโภค ยอดเลยที่1
neg,อยากให้ #TOYOTA ปรับเรื่องไฟหน้า FORTUNER ด้วยครับไฟหน้า ทำมาได้สุดทีน จริงๆครับเปิดธรรมดาก็แสบตามากพอแล้ว เจอบ้างคันเปิดไฟสูงมาลงข้างทางอย่างเดียวครับ อีกรุ่นครับ #MITSUBISHI. #ปาเจโร ไฟหน้ามาแบบ เพื่อนร่วมทางนี้หงายท้องเลยทีเดียวเชียว มันจะทำให้เจ้าของรถโดนเกลียดขี้หน้าไปด้วยทั้งๆ ทีซื้อมาเดิม เค้าจะมาโดนคนอื่นให้พร ตลอดทางเพราะรถ เอานะครับ.
pos,ชอบครับ รถในฝันเลยครับ Honda Accord ไปจองมาเรียบร้อยแล้วครับ
neu,นึกว่า มาสด้า 2 น่าจะทำให้แตกต่าง..สมราคา นะครับ
neu,ตูดเหมือนมาสด้าเลย
