neu,🚗💨💨 ซิ่งเป็นบางเวลา ซ่อกแซ่กได้ทุกที่ << ขับสนุก ชับมัน ใช่เลย‼️ 👍🏻👍🏻 Honda Jazz>>#Jazz Naja
neu,"ใครที่กำลังมองหารถยนต์คู่ใจ อย่าลืมแวะมา ที่ โชว์รูม มิตซู เตชอัมพร นะค่ะ ต้อนรับเมษา 🌤 คุ้มค่ามากกว่าใคร ด้วยโปรโมชั่นร้อนแรง กับ มิตซู เตชอัมพร รับข้อเสนอ สุด HOT 🌟 🚗💨 Mirage , Attrage ⭐️19,000.- 🚙💨 Triton ⭐️28,900.- 🚗💨 Pajero 🔥เลือกรับข้อเสนอโดนๆดอกเบี้ย 0.99% หรือประกันภัยชั้น1 นาน 3 ปี Tel.📱032-232348 😲#มิตซูเตชอัมพร #ถูกกว่า #ดีกว่า #ใช้เงินน้อย #ออกรถได้จริง เปิดทำการ วันจันทร์ - วันอาทิตย์ เวลา 08:00 - 17:00 น."
neg,ขับอัลติส1.8/141ม้า บางทีเจอกะบะกะพริบไฟใร่ตามหลัง หรือบางทีกะบะแข่งกันมาพอเราทำให้ดูมั่งไม่เห็นใครตามมาเลย พอไปเจอเราที่ปั้มมีแอบมองด้วย
neg,ส่งเรื่องเข้าศูนย์ฮอนด้าบริษัทใหญ่ที่กรุงเทพก็ไม่มีอะไรตอบกลับมา
q,ส่วนลด 2 แสน ของ Mazda2 เหรอครับ ^^
neu,รถรุ่น Toyota Ativ #โตโยต้าท่าจีนส่งมอบความสุขที่มากกว่า
neg,สวัสดีครับ ผมกำลังรอรับรถ mazda 2 sk.g 1.3 ช่วยแนะนำข้อดี ข้อเสีย ข้อควรระวังของรถรุ้นนี้หน่อยครับ แนะนำการใช้งานรถใหม่ด้วยยิ่งดีเลยครับ
neu,"ฮอนด้า ชวนสัมผัส “ฮอนด้า คลาริตี้ ฟิวเซลล์”เทคโนโลยียานยนต์แห่งอนาคต พร้อมปลุกเร้าความสปอร์ตไปกับ ""ฮอนด้า ซีวิค แฮทช์แบ็ก"" สีใหม่ 'แดงแรลลี่' ครั้งแรกในงาน Motorshow2018 http://www.ispeedegazine.com/hot-news-2/838-motorshow2018"
neu,ดีแมคแค็ฟมีมั้ยคัฟ
neu,พวกนิสสัน มาร์ช อัลมีร่ามีเปลี่ยนนะครับ
neu,ถ้ามือ1คนยังไม่นิยมแล้วมือ2คนยังจะนิยมหรือตอนนิสสันนาวาร่าขื้นมาตืคู่กับโตโยราคาเขาก็ไม่ตกเหมือนกันเขาว่าเป็นรุ่นว่ารุ่นไหนโดนถ้าfordเขาโตนราคาก็ไม่ตกหรอก
neg,"ก่อนหน้านี้เคยพูดถึงสิ่งที่ Isuzu D-Max ควรเพิ่มเติมหรือปรับปรุง ถ้าให้พูดแบบง่ายๆก็คือ ""ติ"" นั่นเอง ก่อนหน้านี้ก็เคยกับแบรนด์ยักษ์ใหญ่ญี่ปุ่น 2 แบรนด์มาแล้ว แบรนด์นึงมีองครักษ์มาหาว่าผมโจมตีโน่นนั่นนี่ แต่อีกแบรนด์ไม่มีเลยและยอมรับจุดตำหนิด้วยซ้ำ และก็เคยมีสมาชิกบอกให้ติแบรนด์สามเพชรบ้าง คราวนี้ผมเลยจัดให้บ้าง... ก็ Mitsubishi Triton อย่างที่หลายคนรู้กันดีว่ายอดขายรวมจากเดิมที่เคยอยู่ Top 3 ในตลาดกระบะ แต่ในช่วงปีสองปีมานี้กลายเป็นว่าแบรนด์อเมริกันอย่าง Ford ขึ้นมาเป็นอันดับ 3 แทน เรื่องแรกเลยคือหน้าตาที่หลายคนไม่ค่อยจะชอบกัน (แต่คนที่ชอบก็มี) ยังไม่ยอมปรับโฉมหน้าใหม่แม้จะล่วงเลยเข้าปีที่ 4 แล้ว ไม่อยากให้ยึดตาม Roadmap ของรุ่นเดิมๆว่าต้องปรับนิดๆหน่อยๆหรือไม่ปรับเลยตามแบบรุ่นเก่า เพราะอะไรๆมันก็เปลี่ยนไปตามเวลา คู่แข่งเริ่มมีหลายอย่างน่าสนใจมากขึ้น มันมากพอที่จะมาแย่งส่วนแบ่งยอดขายได้หรือร้ายสุดคือทำให้ตกอันดับลงได้ ฉะนั้นแม้ผมจะไม่ได้ซีเรียสมากเรื่องหน้าตาก็อยากจะให้ปรับโฉมหน้าเหมือนกัน อีกเรื่องก็คือเครื่องยนต์ของรถที่ยังคงกั๊กเครื่องดีเซล Mivec 2.4 ลิตร บล็อกล่าสุดไว้แต่รุ่นบนๆ แต่รุ่นล่างๆอย่างกระบะตอนเดียว หรือตัวเตี้ยทั้งหลายยังเป็นเครื่องเก่าอยู่ ส่งผลให้เครื่องเก่าก็ยังได้เกียร์เดิมนั่นคือ ธรรมดา 5 สปีด ส่วนเครื่องใหม่จะได้ ธรรมดา 6 สปีดแล้ว ถึงเรื่องนี้ไม่ค่อยมีใครคิดมาก แต่ผมว่าต้องมีคนอยากให้เปลี่ยนบ้าง เรื่องสุดท้ายคือระบบความปลอดภัยที่พี่มิตซูเล่นให้แค่เฉพาะตัวท็อป 4 ประตู เกียร์อัตโนมัติขับเคลื่อน 4 ล้ออย่างเดียว ทั้งรุ่นธรรมดาและพิเศษ ในขณะที่ค่ายอื่นยังดีที่ให้ในตัวขับเคลื่อน 2 ล้อบ้าง และอีกอย่างก็คือระบบความปลอดภัยมาตรฐานอย่าง ABS EBD ก็ยังไม่มาครบทุกรุ่นเลย บางคนอาจมองว่าไม่จำเป็นแต่ผมว่ามันจำเป็นมากสำหรับคนอย่างผมเลย ก็มีเพียงเท่านี้ครับ...หวังว่าทุกท่านจะยอมรับสิ่งที่ผมกล่าวมา"
neu,นิสสันมาร์ทมีไหมคะ
neg,ขอเเจ้งเรื่องการจองรถหน่อยค่ะมีปัญหาเยอะมากไม่เข้าใจว่าท่าmgจัดการยังไงจองร่วงหน้าเป็นเดือนกว่าด้วยซ้ำจน เเจ้งจะเอารถวันไหน เซ็ลรับปากว่าได้เเน่นอนในเดือนที่เราต้องการได้เเน่นอนไม่มีปัญหา เเล้วก็โทรมาเเจ้งว่ารถมาถึงเเล้ว ท่าดิฉันก็เเจ้งล่วงน่าไปก่อนนานเเล้วว่าสะดวกวันที่เท่าไร พอจนถึงวันรับรถเซ็ลไม่เเจ้งไม่โทรมาบอกว่ารถไม่ได้เเล้วให้เราโทรตามเอง ไม่เเจ้งไม่ตามเรื่องอะไรให้เลย แล้ววันที่ทราบว่ารถมาถึงโทร เช็กเข้าไปที่ศูนย์mg สุวินทวงค์ ท่าผู้จัดการบอกมีการเเต่งรถของดิฉันเเล้ว ฉันเลยคิดว่ารถจะได้ตามวันเเน่นอนเเล้วพอถึงวันรับรถบอกไม่มีรถให้ ทำไมถึงการจัดการรับรถมัวขนาดนี้ค่ะ ตัวเซ็ลก็ไม่มีการสนใจตามเรื่องหรือโทรเเจ้งอะไรลูกค้าเลยต้องมีคนโทรถามเองเช็กเองทุกอย่าง
neu,ขอรายละเอียดมาสด้า2ค่ะ ลอตนี้เปนรถปี2018-2019มั้ยคะ
neu,Hyundai H1 มีไหมครับ
neu,ทาทา มอเตอร์ส ส่งคาราวานบุกทั่วประเทศ ให้บริการเข้าถึงลูกค้ามากขึ้น บริษัท ทาทา มอเตอร์ส (ประเทศไทย) จำกัด ส่ง “ทาทา คาราวาน” (Tata Customer Experience Caravan) ลงพื้นที่จัดแสดงรถกระบะทาทาหลากหลายรุ่นในพื้นที่ภาคต่างๆ ทั่วประเทศไทย ล่าสุดได้ส่งทีมคาราวานรถกระบะทาทาไปยังภาคเหนือในจังหวัดเชียงราย เชียงใหม่ และลำปาง หลังจากที่ประสบความสำเร็จในการยกกองคาราวานไปให้บริการลูกค้าในภาคตะวันออกเฉียงเหนือ และได้รับการตอบรับเป็นอย่างดีทั้งในจังหวัดนครราชสีมา บุรีรัมย์ และสุรินทร์ โดยนำรถกระบะ ทาทา ซีนอน แบบซิงเกิลแค็บ ดับเบิ้ลแค็บ และรถกระบะขนาดเล็ก ทาทา ซูเปอร์เอซ มินท์ ไปจัดแสดง “ทาทา คาราวาน” มีเป้าหมายในการขยายพื้นที่เพื่อเข้าถึงลูกค้าในภาคต่างๆ เพื่อให้ลูกค้าได้รู้จักแบรนด์ ทาทา มอเตอร์ส มากยิ่งขึ้น และได้สัมผัสจุดเด่น ประสิทธิภาพ และสมรรถนะด้านต่างๆ ของรถกระบะทาทา ซึ่งเป็นรถเพื่อการพาณิชย์ที่ตอบสนองความคุ้มค่าคุ้มราคา ประหยัดต้นทุนอย่างแท้จริง นอกจากนี้ลูกค้ายังได้รับประสบการณ์การขับขี่ที่ถูกต้องจากผู้เชี่ยวชาญที่ร่วมเดินทางไปกับคาราวานทาทา โดยมีลูกค้าให้ความสนใจ และสั่งจองรถจากการจัด ทาทา คาราวาน เป็นจำนวนมาก
pos,มีบริการทั้งหมด 4บริการ ครับ ชอบเป็นพิเศษก็คือบริการหลังการขายโดยการรับประกันงานซ่อมถึงหนึ่งปีหรือสองหมื่นกิโลเมตร ทำให้มั่นใจในการบริการหลังการขายที่มีทีมช่างที่มีคุณภาพคอยดูแลและตรวจสอบให้ลูกค้า ทำให้รถนิสสันของเราเหมือนใหม่อยู่ตลอดเวลาครับ #NissanTH #NISSANSERVICE
neu,ฟอร์ดเรนเจอร์mcน่าใช้ปะครับ
neg,ผมขอแชร์ในส่วนของ mazda 3 sky และ 2 sky ครับ ตัววัดมันเชื่อถือได้98%เลยผมว่า คลาดเคลื่อนไปนิสเดียส คือมันหลอกว่าขับได้มากกว่าประมาณ0.3 km /L ครับ ผมวัดเอง เติมกลับ ดก็บผลมา3ปี ได้ประมาณนี้เลย จอมันโชว์ว่าๆได้18.3 km/L จริงๆมันได้ประมาณ18.0km/L งี้ครับ ค่อนข้างเชื่อถือได้เลย ตัวคำนวณมัน
neu,ตัดสินใจจะไปเอา Accord hybrid tech 1.86 ล. แต่ไปลองtest drive BMW 330e .... สรุปเพิ่มเงิน 8 ส. เอา 330e top + BSI 5 ปี ครับ 😂😂
neu,คำถามคือ CP จะใช้รถตัวเองมั้ย เพราะการขนส่งนี่ใช้น้ำมันเยอะมาก กระบะ MG ถูกออกแบบมาให้ใหญ่ อืดและกินน้ำมัน เน้นอ็อปชั่นอำนวยความสะดวกคนขับ ถ้า CP ต้องจ่ายค่าน้ำมันเพิ่มขึ้น 20% โดยความสบายของคนขับรถเพิ่ม ผมว่าเค้าไม่เอา ใช้ Revo หรือ Dmax ตัวล่างดีกว่า ต้นทุนรถสูงกว่าแต่ซ่อมบำรุงน้อยกว่าและประหยัดน้ำมันกว่า
neu,จริงๆก็ถือว่าแพ้ honda แหละครับ มันรวมยังได้แค่ 24xx คัน เฉือน ซิตี้ ไปไม่กี่คัน เพราะ honda ยังมี แบ็กเป็น jazz ด้วย
pos,สนใจ นิสสัน นาวาร่า 2018my vl ศูนย์ไหนมีรถมั่งครับกรุงเทพ/ปริมณฑล
q,ถ้า มิว เซเว่น มีโปรไหมครับ ถ้าจะเทิรนรถเก่าisuzu hilander3.0
neu,D max all new Hi เท่าไหร่ครับ
neu,งงว่าทำไม Revo ดาวน์น้อยกว่าเก๋ง
neu,เออ รอ แอคคอร์ด ตัวใหม่ จบ
neg,มีแววว่าจะไม่ได้ไปนิสสัน...
neu,🌈🌨 ล้างจริงแล้วจ้าาาาาาาาา🌨🌈 🧚🏼‍♀️🧚🏼‍♀️เห็นจริง เปียกจริง โชว์จริง นิสสันเท่านั้น🤭‼️ 👐🏻 งานมี 22-24 มีนาคม 16:00 เป็นต้นไป‼️ ณ ตลาดนัดวัดศรีฯ⛱🤟🏼👩🏻‍🌾 สอบถามโทร.038-203333 ☎️
pos,ผมชอบมาสด้าcx3ครับสวยดีแต่ตอนนี้ขับแจ้ส
neg,Vios กะล๊อคอัตโนมัติเลย. ถ้าลืมกุญแจในรถงานเข้าเลย.
neu,นิสสันมารชราคา?
neg,"คุณยังไม่เข้าใจประเด็น ประเด็นคือ Nissan March, Almera, Sylphy, Pulsar, Juke, Livina , Mitsubishi Mirage, Attrage และ Suzuki Swift Ciaz ต่างก็ใช้ Jatco CVT 7 เช่นเดียวกับที่ใช้ใน All new Suzuki Swift ในเมื่อ All new Suzuki เปลี่ยนน้ำมันเกียร์ทุก 2 หมื่น กม. นั่นก็หมายความว่ารถยนต์ทุกรุ่นในเมืองไทยที่ใช้เกียร์ Jatco CVT7 ก็ควรปรับเปลี่ยนระยะเปลี่ยนมาเป็น 2 หมื่นกม. เช่นกัน"
neu,ขอทราบราคา Nissan Juke ครับผม
neu,มีของ มาสด้า2 2017ไหม ราคา
neg,ยาริสไม่ได้หรูอะไรเลย ของเราปาเจโร่ป้ายแดงยังโดนสาดโครมๆ ดีที่แถวบ้านไม่มีใครเล่นแป้ง... ป้านี่ก็แปลก โดนน้ำทำเป็นโวยวาย ฝนตกทีไม่โวยวายฟ้าฝนหรอ งงใจ
neu,คอนเซปคล้ายๆกับ Nissan E-power
neu,ข้อ (D) รถ Hilux รุ่น Rocco เป็นรุ่นที่หายไป #HiluxRevoThailand
neg,โครตสวย สวยกว่าhonda อีก
neu,นาวาร่า ใช้จังหวะนี้ทำรุ่นใหม่ รุ่น ทนขวาน รวยเละ
neu,ตอบ ข้อ (D) รถHilux รุ่น Rocco เป็นรุ่นที่หายไป😊 #HiluxRevoThailand
neg,#Mazda3 #เช็ครถสตาร์ทไม่ติด
neu,ผมจอง Ford raptor ตั้งแต่ปลายปีที่เชียงราย คิดว่าคุ้มมั้ยครับครั้งแรกคิดว่าไม่เกิน1.5ล้านครับ
neu,ผมกำลังมอง เร็วๆๆ นี้ เช่น toyota Rush / mitsu Extender / ถ้าnissan Mica ที่ยกสูง ถ้าเข้ามาก็น่าสน
pos,นิสสันเอ็กเทล ราคาพิเศษ ภายในกว้าง เหมาะเดินทางไปเที่ยวกันทั้งครอบครัว ชอบมากๆ
neu,มาสด้า2
pos,นิสสัน รถแห่งครอบครัว ภายในกว้างขวาง มีหน้าจอที่แสดงสถานะต่างๆๆขณะขับขี่ ขัดเจน ขับขี่ปลอดภัย
pos,ชอบๆครับ Nissan X-trailกำลังอยากได้อยู่พอดีเลยครับจัดโปรราคาเบาๆให้แบบนี้ถูกใจเลยครับ
neu,ฟอร์ด ไม่เลียนแบบเกียร์ ทนๆของโตโยต้าบ้างหละครับ ขนาดอีซูซุ ยังเอาเกียร์โตโยต้าไปใช้เลย
pos,Nissan navara สวยดีชอบๆครับราคาก็ไม่แพงเกินไปคุ้มๆครับ
neg,สั่งจอง civic 1.5 rs ไป เดือนกว่าๆแล้ว ยังไม่มีวี่แววว่ารถจะมา 😭😭😭 เซลล์ก็บอกรถผลิตอยู่ ให้ รอ รอ รอ รอ
neu,มาตอนนี้ยังทันนะ รีโว่ นิสสันกับมาสด้า สู้ไม่ได้แน่
neu,รถยาริสแถมผ่อนเนี้ยน่ะรวย
pos,ถูกใจเลย กำลังมองหารถใหม่อยู่ ต้องไปชมสักหน่อย Hoda civic new Hatchback red ดูภายนอกก็สวยมากแล้วค่ะ ไปชมที่งานมอเตอร์สักหน่อย
neg,CX3 ถือว่ากินขาดทั้งสมรรถนะและช่วงล่าง กับคู่แข่งเซกเม้นเดียวกัน จะแพ้ตรงภายในห้องโดยสาร กับราคาอะไหล่ค่าบำรุงรักษา นี้แหละ
neu,Mazda 2 ดีเซล คับ
pos,สุดยอดครับโตโยต้า
neg,อเมร่า เทียน่า นาวาร่า ซิลฟี่ เหมือนกันหมด
neg,นอสเริ่มต้นจากศูนย์ค่ะ ซึ่งเป็นศูนย์โตโยต้า เพราะรถนอสมีปัญหาต้องถ่ายน้ำมันเครื่อง นอสรีบมาที่สุดแล้วค่ะ ทำเต็มที่แล้วจริงๆ
neu,สนใจค่ะนิสสันมาร์ชค่ะ
pos,พี่ก็เคยชอบ CX-3 นะ รู้สึกว่าขับได้ไกลกว่าหน่อยนึง
neg,เป็นประจำครับ ถ้าเป็นโตโยต้า ไม่ว่าเก่าหรือใหม่ ใจเย็นๆครับมันจะค่อยๆขึ้นเองครับ ถ้าไม่แน่ใจเวลาเติมน้ำมันควรสังเกตุเวลาเติมครับ ไม่ใช่จอดรถปุ๊บขว้าโทรศัพปั้บ แล้วมาว่าเค้าเอาเปรียบโน้น นี่ นั้น ครับ
neu,รุ่นนี้หรือเปล่าครับ Honda Pilot ใหญ่กว่า Crv มีขายในอเมริกาครับ จัดอยู่ในระดับเดียวกับ Mazda CX-9 ครับ
neu,"สวัสดีค่ะ คุณ สำหรับโคโลราโด รุ่น 2.5L VGT X-Cab LTZ Z71 ราคาเริ่มต้น 799,000 บาท ดาวน์ 25% เงินดาวน์ 199,750 บาท ผ่อนนาน 72 เดือน ผ่อนต่อเดือน 4,999 บาท เฉพาะงวดที่ 1-12 ส่วนงวดที่ 13-72 ผ่อนต่อเดือน 9,797 บาทค่ะ หากต้องการทราบราคาดาวน์และผ่อน พร้อมทั้งโปรโมชั่นเพิ่มเติม inbox มาหาเราได้เลยนะคะ ^_^"
q,มีข่าวรีโว่ร็อคโค่ ตัว 2.4L ไหมครับ ที้จะออกมาใหม่เดื่อนหน้า
neu,กิจกรรมสุดพิเศษ ISUZU MU-X DAY ณ อีซูซุ เมโทร สาขาราชพฤกษ์ 😆
neg,มาสด้ากับนิสสันพอครบ5ปีเครื่องพัง...ครัชพัง...เกียร์พัง...ขายทิ้งราคาก็ต่ำสุดไป...
