review,sentiment
ต้องรุ่นนี้เลยครับ Honda Civic มันเป็นรถที่มีเสน่ห์มากๆ ผมไปเดินงาน MotorShow ทีไรต้องมองและเข้าไปลองสัมผัสทุกที แต่ยังเก็บเงินซื้ออยู่ครับ รุ่นนี้บอกเลยผมต้องซื้อมาขับเป็นคันแรกแน่นอน ขอเก็บเงินอีกหน่อย ใกล้แล้วๆ ปลไม่มีภาพคู่กับรถ แต่อีกไม่นานครับ ฝันนให้ไกลไปให้ถึง ฮอนด้าที่รัก EnjoyHondaThailand,1
Civic น่าใช่กว่ายาริสนะคะ ลองมาดูก่อนได้นะคะ ลาดพร้าว  ค่ะ,2
มีนาคมนี้ ไม่ต้องรอให้ถึงงาน MotorShow ก็รับ โปรโมชั่นมอเตอร์โชว์ได้ทันที แค่ลูกค้าจองรถกับเราที่ โชว์รูมนิสสันบางนากม ดาวน์ต่ำ ผ่อนสบาย ดอกเบี้ย ฟรีประกันภัยชั้นทุกรุ่น MARCH ALMERA NOTE SYLPHY TEANA NAVARA XTRAIL  รถใหม่ป้ายแดง ดาวน์น้อย ผ่อนสบาย โปรโมชั่นดีดี  โทร  ฝ่ายขาย สยามนิสสันเซลส์ สาขาบางนากม,0
ประตู toyota หนี ford ไม่ห่าง แนวคิดคนใช้รถเริ่มเปลี่ยนไปไม่ยึดติดยี่ห้อแต่คิดถึงความคุ้มค่าและความปลอดภัยกับชีวิตมากขึ้นนะ,0
ใหม่ กระบะพันธุ์ลุยจาก Arctic Trucks เตรียมลุยตลาดอังกฤษ,0
มันคือ Mitsubishi GCPHEV Concept ที่เอามาขัดเกลาใหม่,0
ถ้าเราไม่ชนเขา เขาก็ชนเรา อุบัติเหตุเกิดขึ้นได้ตลอดเวลา การันตีมาตรฐาน ความปลอดภัยสูงสุด ระดับ 5 ดาว  เอทีฟ และ ยารีส  สอบถามได้ที่ httpsmfacebookcommsgtoyotaphrae หรือ httpslinemeRtiptoyotaphrae แพร่หล่อตระกูลขายโตโยต้า ซื้อโตโยต้าต้องมาที่ โตโยต้าแพร่หล่อตระกูล Yaris ATIV,0
ไม่ตายหลองคนับDmaxมันขายได้ยุแล้ว ราคาเริ่มต้นล้านห้าอัป,0
ไปจองมาแล้วนาจา Mitsubishi Attrage ได้หลังสงกรานต์เลย รอขับอยู่นาจา กระทัดรัด เหมาะกับสาวๆขับรถคนเดียวแบบเรา ราคาสบายกระเป๋า ประหยัดน้ำมัน วิ่งไกลแค่ไหนหายห่วงค่ะ,0
ดีแม็กตอนครึ่งปี ตัวท๊อป ทำประกันชั้นหนึ่งเท่าไร,0
สามารถดูราคารถยนต์ New MG ZS ตามลิงค์นี้ได้เลยครับ httpmgcarscomthmgmodelsmgzsdetailprice,0
ได้เลยครับ คุณลูกค้าสามารถเข้าไปอ่านรายละเอียดข้อเสนอสุดพิเศษของ Nissan Navara ได้ที่นี่เลยครับ httpswwwnissancothoffersnissannavarahtml,0
Honda Civic ห้าประตูสีแดงสดสวยมากเลยครับ น่าสนใจจริงๆ,1
นิสสัน อัลเมล่า ถายในกว้างใหญ่ นั่งสบายภายนอกสวยงาม ราคาไม่แพงประหยัดน้ำมันสุดๆ,1
สีบรอนเงิน  นิสสันจู้ค ทะเบียน 5 ขอนแก่น,0
ของผมพฤกษ์ลดา ข้างบ้านมี vios  คัน CRV  คัน รถตู้  คัน ฟอจูนเน้อ  คัน มอเตอไซด์  คัน เวลาจอดในบ้าน ก็vios และ รถมอเตอไซด์ ที่เหลือก็ข้างนอก ริมฟุตบาทเลยจ้า แต่เค้าก็ยังมารยาทดีนะ ฟอจูนเน้อที่ปีนขึ้นฟุตบาทเลยจ้า 555 แต่โชคดีครับ ที่คนแบบนี้ไม่ค่อยเยอะ เลยไม่มีปัญหาอะไรมาก แค่บ่นๆ ด่าๆ แต่ไม่กล้าว่าตรงๆ แค่นั้น 55555,0
นิสสัน นาวาร่า,0
วีออสเจอแบบนี้บ่อยไปแล้ว ชักเริ่มกลัว เข้าศูนย์ด่วน,2
นิสสัน เทอร์รา รุ่นใหม่ เตรียมเปิดตัวในประเทศจีน ช่วงฤดูใบไม้ผลิปีนี้,0
ดับครับ สำหรับ Dseg ของนิสสันในไทย ทั้งที่รถมันดีมากนะ นอกจากการตลาดของบริษัทจะห่วยแล้ว พวกโชว์รูมรถก็ห่วยครับ ขนาดโชว์รูมใหญ่ประจำจังหวัดนึงในภาคเหนือยังมีรถมาโชว์ไม่ครบเลย เทียน่าเนี่ยไม่มี รถ suv ก็ไม่ที มีแต่รถเล็กกะซิลฟี่ ห่วยอ่ะ บอกตรง,2
มาสด้า ได้โลลิตรนี่ไม่ค่อยเท่าไหร่ แต่ที่ไม่สบายใจมากๆคือ yarisตัวเก่า ทำไมสปีดดีเวอร์ อันนี้สงสัยสุดๆ,0
ถ้าไม่มีเรนเจอร์โมเดลปี ฟอร์ดประเทศไทยจบเห่ไปแล้ว,2
เพิ่งออก JAZZ มาเมื่อ   ค่ะ ขอแนะนำ คุณปุ๋ย Honda อุดมสุขค่ะ โทร  ประทับใจตั้งแต่วันที่เข้าไปดูรถเลย,1
ทำมัยต้องปาเจโร่ เอเวอเรสต์ก็มี มิวเอ็กซ์ก็มี ฟอจูนเนอร์ ก็มี ค่ายอื่นเค้าน้อยใจนะ,0
แท็กซี่ส่วนบุคคลนี่ ฟอจูนเนอร์ ตัวใหม่ 5 m เห็นหลายคันอยู่ แถวสุวรรณภูมิ นับประสาอะไรกับ ซีวิค k  ถ้า สหกรณ์เหมาไปทำหลายสิบคันก็ไปอย่าง,0
มาสด้า ออกโรงชี้ สาเหตุที่ฟ้องร้องเรียกค่าเสียหายจากลูกค้า 5 ล้านบาท ชัดเจน,2
ขอข้อมูล แอคคอร์ด ราคาหน่อยครับ ตัวทอป,0
กระบะนิสสันนาวาร่าช่วงล่างแกร่งมากครับ,1
โตโยต้า รีโว้นี้หรูแล้วหราา,3
Honda Jazz เหมาะกับไลฟ์สไตล์การใช้ชีวิตจริงๆ รูปลักษณ์โฉบเฉี่ยว สวยโดนใจ,1
ดีพอใจมากครับ เบรคนุ่มไปไกลๆมาแล้วเบรคมั่นใจ ขับไม่เกิน  ผมเปลี่ยน  ล้อเลยนะ Honda Civic FB เปลี่ยนน้ำมันเบรคด้วยครับ,1
ดีแม๊กคันหล้งคับดาวเท่าไรคับ,0
ยึดโรงงานอีซูซุ ยึดโรงงานฮอนด้า ให้มาเป็นผลิต nissan navara  dci turbo  HP WD AT,0
นิสสันนาวารา มาพร้อมกับนวัตกรรมใหม่ กล้องมองรอบทุกทิศทาง เพิ่มความปลอดภัยในการขับขี่ น่าสนใจมากๆค่ะ,1
toyota มันอาจจะคิดว่า ตัวฟอจูน คงบรรทุก ไม่เท่า Revo เพราะมันสายกะบะ มันจำเป็นกว่า แต่มันลืม ไปว่า ฟอจูนนั่ง  คนตูดมันยังห้อย คอนเซ็ปฟอจูน ตูดห้อยหน้าลอย,0
เราขับ crv ไม่เตี้ยนะ  ไฟฟอร์จูนเนอร์ยังทิ่มตาเราทะลุได้เลย  X ก็ไม่เตี้ย กระจกมองหลังรอดเพราะมันเบลนเขีย,1
Teana รถดีนะ ผมเคยใช้ J,1
TOYOTA รุ่น CHR,0
แปลว่านิสสันมารก็ไปได้ซิครับ,0
เท่าวีออส คุ้มมาก,0
ดูดีกว่ายาริสอยู่,2
Honda HRV Minor Change จะเปิดให้จองในไทยเมื่อไหร่ครับ Hondaรถยนต์,3
เพราะ Toyota กับ honda ใช้ชื่อในการทำตลาดต่างกันระหว่าง  กับ 5 ประตูมั้งครับ ราคาก็ต่างกันด้วย แต่ Mazda ใช้ชื่อเดียวกันราคาขายก็เท่ากันทั้ง  และ 5 ประตู,0
นึกว่านิสสันจู๊ดดดด,0
การเปิดตัว Ford RANGER RAPTOR ครั้งแรกของโลก RangerRaptor,0
พี่ขับนิสสัน 555,0
พรีอุส ทำไว้ดีครับ ทนทาน ปัญหาน้อย,1
สน มาสด้า,1
สนจัยนิสสันโนสผ่อนเท่านี้ดาวเท่าไหร่,0
ผมว่า ford Fusion ดูไม่สมกับเป็นรถใหญ่เท่าไหร่ ผมเคยนั่ง Fusion รุ่นนี้อยุูครั้งนึง ความกว้างของมันก็ประมาณ honda civic อ่ะครับ ไม่ก็ ford focus ขยายร่าง มันดูไม่ได้กว้างขวางเท่าไหร่เลย และไม่ต้องไปคาดหวังความหรู รถ Dseg ที่ขายในอเมริกาไม่หรูเลย การตกแต่งภายในเหมือน Cseg มาก,2
อยากได้เซลล์ปรึกษา รุ่น mg zs กับ mg หน่อยค่ะ อยู่แถวบางปูค่ะ,0
สวยกว่าแอคคอร์ดตัวใหม่อีก แอคคอร์ดตัวใหม่เห็นไฟท้ายแล้วไม่ผ่าน,2
ใช่แล้วครับ พวกดีเซลตัวทำมลพิษเลย แย่จริงๆ ว่าแล้วก็เอา MU X  ไปอุด EGRRemap ดีกว่า 555,0
ทำไมมุมนี้มันแอบเหมือน Mazda  หนอ หรือผมคิดไปเอง,0
ISUZU MUX  BLUE POWER,0
ดีใจมีรถยี่ห้อแรกไปทำโฆษณาที่หินสามวาฬบ้านผม ใช้วีออสอยู่ครับ ชอบรีโว,1
โตโยต้า ประกาศราคา TOYOTA CHR เริ่มต้นที่  บาท httpwwwispeedegazinecomhotnewstoyotachr,0
ผมว่า ฮอนด้า ไม่ต้องเล่นตลาด eco car ก็ได้นะ ซิตี้ แจ๊ซ ให้มันอยู่ Bsegment ไปดีแล้ว เพราะถึงไง ฮอนด้า ก็เก็บส่วนแบ่งการตลาดจากพวกรถที่มีตำแหน่งก้ำกึ่ง เช่น โมบิลิโอ้ บีอาร์วี เอชอาร์วี พูดแล้วก็สงสัย บีอาร์วี มีไว้ทำไมตัวรถสูงกว่า โมบิลิโอ้ แค่ไม่เท่าไหร่,0
อันนี้ยอม คล้ายจริง ที่เหลือยกให้การตลาดของnissanไทยละกัน,0
ดีลเลอร์ Nissan บราซิลได้เห็นภาพ Presentation ยืนยันว่า All NEW Almera จะมีสัดส่วนความปราดเปรียวคล้าย Chevrolet Cruze รุ่นใหม่มาก ดูสปอร์ตแต่ยังคงความกว้างขวางเช่นเคย ส่วน All NEW Sylphy จะมีขนาดกว้างขึ้นแต่เตี้ยลงคล้าย Honda Civic,2
คันขับอยู่ในปัจจุบันคือ อีซุซุ ดีแมค เอ็กซ์ซีรีส์ ท็อปยกสูง ครับผมอยากได้อีกคันอยู่ครับผม,1
ตารางค่าบำรุงรักษารถยนต์นิสสัน httpswwwnissancothownersmaintenancecostshtml,0
ฮุนได H ขนผักในตลาดไทก็มีครับ ไม่เชื่อไปดูได้ มันไม่เกี่ยวหรอกครับว่ารุ่นนี้จะเอามาตีครอกขนผักไม่ได้,0
นิสสันอัลเมร่าน่าใช้ ทั้งประหยัดน้ำมันทั้งคล่องตัวด้วยครับ,1
ดีแมคยอดไม่ตกเลย นีโว่เปลี้ยนเปนร็อคโค่ก็กลับมาได้เดือนเดียวแบบฉิวเฉียดแต่พอโดนแซงกลับโดนแบบขาดลอย ซีวิคก็ไม่เคยแพ้อัลติสเลย ฟอร์จูน ก็นำโด่งทุกเดือนไม่เคยเปลี่ยน,0
พวกขับฮอนด้าเหี้ยทุกตัว โดยเฉพาะ ซีวิค กับแจ๊ส ลาวสัส,2
ส่งเดือนเท่าไรคับดีแมกปะตู,0
ไฟท้ายแคมรี่มีป่าว,0
รถฟอร์ดเกียร์ห่วยขายไปยัง,2
สอบถาม vios,0
ขอรายละเอียด มาสด้าว่ามีโปรบ้างครับ,0
รัก Mitsubishi Muihuad Motorsales มากๆเลยค่ะ,0
สงกรานต์นี้ พา ขุนเรือง ขับ YARIS ไปที่ บ้านเรือนไทย,0
ชมภาพคันจริงเน้นๆ All New Suzuki Swift อะไรเปลี่ยนแปลงบ้าง ไปชมกัน,0
FORD EVEREST  ติดตั้งกระจกฝาท้าย  โดยช้างผู้ชำนาญงาน,0
ดีแม็ก ประตูครับแค่นี้ก็สุขใจแล้ว,0
ไม่เอาจะสมัคร Toyota,0
มาสด้า ขอรายละเอียดคะ,0
เปิดตัวเจ้าก๊อตซิล่า Nissan GTR Premium Edition Thailand R5  ในไทยพร้อมค่าตัว 5 ล้านบาท Nissan ประเทศไทย ตัดสินใจเปิดตัว Nissan GTR R5 อย่างเป็นทางการหรือเจ้าก๊อตซิล่า พร้อมจำหน่ายในประเทศไทย คุ้มค่าสำหรับการรอคอยโฉมใหม่มาอย่างยาวนาน เคาะราคาแล้ว 5 ล้านบาท ในงานบางกอก อินเตอร์เนชั่นแนล มอเตอร์โชว์ ครั้งที่,1
ส่งแผนมาปรับปรุง nissan ประเทศไทยด้วยนะครับอย่าปล่อยทางนี้อ้างว้างเหมือนดังเคย,0
Mazda จัดเต็มมอเตอร์โชว์เปิดตัวรถใหม่  รุ่นรวด ได้แก่ Mazda ใหม่ Mazda ใหม่ และ MX5 เกียร์ธรรมดา อีกทั้งยังจัดโปรโมชั่นสุดพิเศษที่ใครก็ห้ามพลาด,0
จะเดินทาง ไกล้ไกล ไปได้ทุกที่ กับ นิสสัน เอ็กซ์เทรล ตัวนี้ ได้ใจใคร หลายๆคน สวยแบบมีสไตล์ ต้องนิสสันเอ็กซ์เทรล,0
มาทำความรู้จักและทราบขั้นตอนการทำงานของ เทคโนโลยี Honda Connect ว่าสามารถทำให้คุณมั่นใจในการขับขี่มากยิ่งขึ้นได้อย่างไรบ้าง ที่นี่มีคำตอบ ดาวน์โหลด แอปพลิเคชัน Honda Connect Thai โหลดฟรี พร้อมติดตั้ง TCU Telematics Control Unitได้แล้ววันนี้ที่โชว์รูมกระบี่ฮอนด้า ทั้งสาขา พิเศษ รับฟรี บัตรของขวัญฮอนด้า มูลค่า  บ เมื่อติดตั้ง TCU ถึง  มีค5 เท่านั้น wwwhondacoththhondaconnect HondaConnect HondaConnectThai EnjoyHondaThailand,0
นาวาร่าแคปผ่อนพันเท่าไรแร่ะผ่อนกี่เดือนคับ,3
ตอนผมทำงานออฟฟิศ ผมขับ Honda City แต่พอออกมาทำงานค้าขายส่วนตัว ผมขับ Camry Hybrid บอกเลย เป็นลูกจ้างเหนื่อยอย่างเดียว ไม่สบายแน่ๆครับ,2
นิสสัน นาวาร่า แบล็คอิดิชั่น รูปทรงแข็งแรงบึกบึน สวยน่าใช้มากครับ แถมมีโข้อเสนอ ปรโมชั่นพิเศษอีกเพียบสุดยอด,1
mg5 เป็นรถที่น่าใช้นะ แต่ทำไมยอดไม่ขึ้นเลย,1
มั่นใจกับการขับขี่ยามค่ำคืน ที่คุณไร้กังวลการใช้งานไฟสูงแบบ Adaptive LED Headlamps ปรับระดับสูงต่ำอัตโนมัติ AdaptiveLEDHeadlamps ALLNEWMAZDACX5 MazdaCG MazdaCGThailand MazdaThailand,2
คอมเมนต์ตรงนี้ถกกันมันมากเลยนะครับ 5555 ปล Navara ไม่มี  แรงม้าครับ มีแต่  แรงม้านะครับ ปล จะแรงไม่แรงคนที่กำลังซื้อถ้าลังเลก็ลองถามผู้ใช้จริงดูนะครับ เอาคนที่ใช้หรือเคยขับโฉมปัจจุบันนะครับ ไม่ใช่ขับรุ่นเก่าแตเอามาตีมาตรฐานรุ่นใหม่ตามรุ่นเก่าไปด้วย,0
ฮุนไดต้องการสร้างฐานการผลิตรถยนต์ใหม่ในเอเชียตะวันออกเฉียงใต้ httpsseasiacohyundaitobuildaplantinsoutheastasia,0
เก็บข้อมูลแบบนี้ให้ผมดูหน่อยสิ ถ้าว่างๆ อันนี้ Altis  ขับไม่เกิน  บังคับอัตราการเร่งให้ไฟ eco ขึ้นโชว์ตลอด,0
ที่บ้านมีรีโว่ประตูพอสัมผัสฟร์อดประตู บางทีก็ยากถามนะ คือ รถรุ่นนี้มึงคือรถเกรดเดียวกันปะวะ ทำไมความรุ้สึกของช่วงล่างมันห่างไกลกันจังฟร์อดกินในทุกๆย่านความรู้สึกเลยเฮ้อ,2
กุญแจSuzuki Swiftใส่กรอบ GTR แน่นอนชัว,0
Mazda มีเสียงดังแต๊กๆ รถยนต์,2
เรื่องโดนฟ้อง ใครตามข่าวๆดีจะรู้ว่าเป็นไงครับ คนไม่ตามข่าวตลอดตามช่วงแรกก็จะคิดว่าฟ้องคนซื้อครับ ที่นี้พอมีข่าวรถมาสด้า ก็จะเกิดคำพูดนี้ขึ้นมา ไม่เอาไม่ซื้อกลัวโดนฟ้อง,2
สื่อเมิน พ่อค้าผักแฉกระบะค่ายดัง Revo เอาเกียร์ Vigo มาใส่ ข่าวยานยนต์ เว็บรถมือสอง Unseencar,2
นิสสัน นาวารา รถสวย สมรรถนะสุดยอด ชอบค่ะ,1
หนูก็ขับแอททราจนะคะ ป้าลิ่งพาเลาะตลอดเรยประหยัดดีชอบๆ,1
แล้วของออนิวยาริสมีไหมคับ,3
รีโว่ รอคโค,0
ได้เวลาวิ่งทดสอบ Ford Ranger Raptor ภาพจากคุณ Archara,0
นิสสันกระบะแกร่งจริงๆ ลุยได้ทุสถานะการณ์,1
คำขี้บ่นจากชาวคลับรถ CHR เวอร์ชั่นไทย รถยนต์ไฮบริด,2
ใช้ Honda มาตลอดค่ะสุดยอดมากๆมั่นใจปลอดภัยทุกการขับขี่ รถใหม่คันต่อไปก็ต้อง Honda,1
