review,sentiment
ซิ่งเป็นบางเวลา ซ่อกแซ่กได้ทุกที่  ขับสนุก ชับมัน ใช่เลย  Honda JazzJazz Naja,0
สนใจ ฟอจูนเนอร์ สีขาวครับ,1
Nissan คงใกล้จบแล้วแน่ๆ,2
สุดเท่กับชุดแต่ง RS มาพร้อมภายนอก สปอร์ต ดุดัน และเทคโนโลยีเพียบ  Thaicarlover Chevrolet CruzeRS,0
แดงโดนใจจริงๆ  Honda Civic Hatchback Rallye RED ลุยงาน MotorShow หลังจากที่เคยเปิดตัวในรุ่นซีดาน  มาพร้อมระบบสตาร์ทเครื่องยนต์แบบอัจฉริยะ One Push Ignition System แค่เพียงกดปุ่ม Start เครื่องยนต์ 5 ลิตร เทอร์โบ ของ Honda Civic RED Turbo RS ก็พร้อมจะไปกับเราในทุกเส้นทาง  ราคาค่าตัวอยู่ที่  บาท  ใครสนใจไปพบตัวจริงกันได้ที่บูธ A อาคารชาเลนเจอร์ฮอล์  อิมแพค เมืองทองธานี,1
ผมเคยถามคนขับแท็กซี่มาแล้วครับ แกบอกมาแบบนี้นะ โตโยต้าที่นิยมเอามาทำแท็กซี่เพราะเค้ามีโควต้าให้คนซื้อรถที่จะเอามาเป็นแท็กซี่ครับ ถูกกว่าขี้หมูขี้หมาก็คันละ  ในขณะที่ฮอนด้าก็ไม่ได้ห้ามแต่เค้าขายราคาปกติครับจะซื้อมาทำแท็กซี่ก็ต้องจ่ายเหมือนกับคนอื่น เหตุนี้จึงทำให้ไม่นิยม ส่วนเรื่องอะไหล่กับความคงทนผมว่าไม่ใช่ประเด็นอ่ะถ้ารถมันพังง่ายขนาดนั้นคงขายไม่ได้หรอก คุณภาพรถญี่ปุ่นผมว่าก็พอๆกันน่ะแหละประเด็นคือเรื่องราคาตามที่พี่แกว่ามากกว่า,0
นิสสัน suv ที่เพิ่งเปิดตัวที่ฟิลิบปินส์เป็นไงบ้างครับ สมรรถภาพ มาไทยเมื่อไร,3
toyotaกับhondaต่างกันตรงการซ่อมบำรุงราคาซ่อมที่ต่างกันน่าจะจุดเลือกที่นิยมtoyotaมากกว่าแต่ถ้ามีเงินซ่อมบำรุงรถก็จบสำคัญที่สุดอยู่ที่ความต้องการของเจ้าของรถ,0
ขอบ  ใส่ xtrail เท่ารัยครับ รับเทรินขอบเก่าด้วยมั้ยครับ มีขอบ  เลนโซอยู่ครับ,0
ช็อคที่  Benz ขึ้นอันดับ 5 ชนะ มิตซู นิสสัน ฟอร์ด ช็อค  MG มาแรงมาก ช็อค  เข้าไปดู BMW ติดที่  ปล chev หายสาบสูญ อันนี้ไม่ช็อค,2
นิสสันโน๊ตครับ,0
นี่นิสสันยังดูไม่ใหญ่อีกเหรอครับส่วนตัวคิดว่ารถกระบะนิสันออกแบบดูเทอะทะกว่าค่ายอื่นในยุคเดียวกันแต่ดูตัวเลขแล้วก็ไม่ได้ใหญ่นะถ้าเขาเดินเกมแบบค่ายเจ้าตลาดทั้งค่ายหรือออกตัวเท่ๆแบบฟอร์ดน่าตะไปได้ดีกว่านี้ฟอร์ดยังไม่ใข่แรปเตอร์นะแรปเตอร์ส่วนตัวว่าแรปเตอร์เป็นปิคอัพหรูน่าจะเฉพาะกลุ่มที่เงินถึงๆ,2
GET 5 ร่วมสร้างปรากฏการณ์เรืองแสงสุดยิ่งใหญ่ เอาใจคนรักสุขภาพ ใน HONDA GET GLOW RUN httpwwwjiggabancomget5 GET 5 ร่วมสร้างปรากฏการณ์เรืองแสงสุดยิ่งใหญ่ เอาใจคนรักสุขภาพ ใน HONDA GET GLOW RUN กลับมาอีกครั้งกับงาน HONDA GET GLOW RUN มหกรรมวิ่งเรืองแสง ณ สะพานพระราม  ที่จัดโดย คลื่น GET 5 บอกได้คำเดียวว่า ครั้งนี้จัดเต็มยิ่งใหญ่อลังการกว่าเดิม รวมพลนักวิ่งทั้งมืออาชีพ และมือสมัครเล่นกว่ GET 5 ร่วมสร้างปรากฏการณ์เรืองแสงสุดยิ่งใหญ่ เอาใจคนรักสุขภาพ ใน HONDA GET GLOW RUN กลับมาอีกครั้งกับงาน HONDA GET GLOW RUN มหกรรมวิ่งเรืองแสง ณ สะพานพระราม  ที่จัดโดย คลื่น GET 5 บอกได้คำเดียวว่า ครั้งนี้จัดเต็มยิ่งใหญ่อลังการกว่าเดิม รวมพลนักวิ่งทั้งมืออาชีพ และมือสมัครเล่นกว่,0
แม้ว่า Nissan Maxima และ Murano ในปัจจุบันทำยอดขายดีขึ้นกว่ารุ่นเดิมแค่ระดับหนึ่ง แต่ในจีน Maxima กลับล้มเหลว Murano แค่พอไปได้ นี่อาจจะเป็นเหตุผลหลักที่ทำให้การปรับโฉม Minorchange ต้องดูสง่างามขึ้น,0
นิสสันโน๊ต รถประหยัดน้ำมัน ราคาเบา ดีไซร์เลิศ ขับขี่ดีมากๆ ใครๆก้อชอบ มีหลายสีให้เลือกด้วยครับ,1
พลาดเพราะรีโว่นั่นแหละ,0
ถ้าทำประตูเปิดเหมือนRX เจ้า CHR จะเป็นผู้บุกเบิกรถทรงนี้อย่างเต็มตัวเพราะมันจะเข้ากับบุคลิกรถแคปทึบสปอร์ตน่าเสียดาย,2
วันนี้นะ ที่ลานโตโยต้า คุณวาสี ถนนชัยภูมิบ้านเขว้า,0
ชาวกรุงตื่นเต้น รถบ้านสุดฮิป U Motel ที่ถูกเนรมิตขึ้นมาจาก U Beer SleepWithU UMotel อย่าลืมติดดาวเพจ httpswwwfacebookcomUBeerThai เพื่อไม่พลาดเรื่องราวและกิจกรรม,0
Civic ทุกรุ่นใช้ระบบกันสะเทือนหน้าแบบคอยล์สปริง ด้านหลังทอร์ชั่นบาร์พร้อมคอยล์สปริง เครื่องยนต์ยังคงใช้รหัส D และเพิ่มรุ่นใหม่ 5 ซีซี CVCC โดยในปี  ได้เพิ่มรุ่นแรงรหัส Si สำหรับทำตลาดญี่ปุ่น ปรับปรุงระบบกันสะเทือน และใช้เครื่องยนต์ DOHC ZC ความจุ  ซีซี กำลังสูงสุด  แรงม้า ส่วนรุ่นที่ทำตลาดในสหรัฐอเมริกาในชื่อ Civic Si  ประตู และ CRX Si ใช้เครื่องยนต์หัวฉีด  วาล์ว กำลังสูงสุด  แรงม้า เดือนพฤศจิกายน  ฮอนด้าเพิ่มระบบขับเคลื่อน  ล้อให้ Civic เป็นครั้งแรกในรุ่น Shuttle ช่วงแรกมีปุ่มกดสำหรับเข้าออกจากระบบขับเคลื่อน  ล้อที่เรียกว่า Realtime เพราะสามารถทำได้ขณะรถวิ่ง จากนั้นในเดือนกุมภาพันธ์ 5 จึงเพิ่มรุ่น Quint Integra ตัวถังแฮทช์แบ็ก  ประตู ฐานล้อ 5 มิลลิเมตร และในเดือนพฤศจิกายน  เพิ่มรุ่น 5 ประตูแฮทช์แบค พร้อมขยายขนาดฐานล้อเป็น 5 มม,0
Nissan Xtrail ขับนิ่ม เสียงเงียบ สบาย คล่องตัว,1
Nissan Note ดาวน์เท่าไรค่ะ,0
น่าสนใจค่ะMGเป็นรถที่ออกแบบเพื่อความปลอดภัยรูปแบบทรงสวยทันสมัย,1
เผยรถต้นแบบ Small Rs Concept ที่คาดว่าจะเป็น All New Honda Brio รุ่น RS,0
เขานั้นขี่ ฮอนด้าแจส มาจีบเจ้า พี่นั้งเศร้า ข้างฟีโน่ โง่เหมือนหมา ชีวิตพี่ วันวัน นั้นไปนา ส่วนแก้วตา จับปากกา ในห้องแอร์,0
รหัสตัวแรงครั้งแรกใน SUV ของค่าย มากับเครื่องยนต์เบนซิน  EcoBoost เทอร์โบคู่ 5 แรงม้า 55 นิวตันเมตร เกียร์อัตโนมัติ  จังหวะ ขับเคลื่อน  ล้อ,0
มาสด้าดาวกี่บาทคับ,0
มองว่าไงถ้าเทียบกับ HRV และ Subaru XV,3
ตอนแรกอยากได้ jazz ไปๆมาๆ แม่บอก พ่อขับไม่มรถมันเล็ก เอาคันที่ขับได้ทั้งครอบครัว จบที่ civic จ้า งงๆไปอีก,2
รถในฝัน อยากได้จัดให้ โตโยต้า ใจป้ำมอบรถในฝันโตโยต้าฟอร์จูนเนอร์รุ่นท็อปราคา  ล้านให้ศรีสะเกษ  คัน กำหนดมอบวันเสาร์ที่  มีคนี้ที่ค่ายนครหลวงโปรโมชั่น,0
ซื้อแจสขับดีก่าแบบนั้ย,0
แสนให้ออกวีออส เหรอ ผมคนหนึ่ละไม่เอาแน่ เอาเงินไปซื้อ เบนซ์ E cdi มือ ปี   มาขับดีกว่า ครับ,2
ในขณะที่ Mazda Thailand ส่งหมายเรียกลูกค้า ให้ไปขึ้นศาล ในฐานะจำเลย พร้อมเรียกร้องให้ชดใช้ 5 ล้านบาท ทั้งๆที่เหตุเกิดจากรถที่ตัวเองขายนั้นไม่ได้มาตรฐาน และเกิดปัญหา ผมเพิ่งเป็นลูกค้ามาสด้าได้ครึ่งปี ซื้อ mazda  ดีเซลตัวท็อป กำลังจะผ่อนหมดในอีกไม่นาน และเคยคิดว่าจะซื้อ cx5 แต่ตอนนี้ไม่แล้ว คงบ๊ายบายค่ายนี้อย่างจิงจัง เพราะไม่นึกว่าผู้บริหารจะกระทำการที่ไร้สามัญสำนึกได้ถึงขนาดนี้ ขนาดฟอร์ด เค้าโดนร้องเรียนเรื่องเฟียสต้ามาขนาดไหน ถึงจะแก้ปัญหาไม่ได้แต่ก็ไม่เคยมาฟ้องร้องลูกค้า ความคิดพวกคุณนี่แม่งโคตรสกปรกเลย,2
พี่เขยผมจะเอารีโว่แต่ไม่ผ่านแนน เลยเอาดีแมกแทน,2
ขอสอบถามเซลล์โตโยต้าหน่อยครับผม Toyota Yaris รุ่น Top ตอนนี้มีส่วนลดหรือของแถมอะไรได้บ้างครับ,3
ปิคอัพ โตโยต้า ไทเกอร์ แคป ราคาเท่าไหร่คับ,3
นิสสันโน๊ต ดาวน์เท่าไรคะ,0
รอ MG ตัวใหม่ อย่างหรู,0
นี่แหละครับรถที่ใช่  คันที่อยู่แถวที่ 5 นับจากแนวนอน คอลัมน์ที่  นับจากซ้ายไปขวาคือ ฮอนด้า ซีวิค แฮทช์แบ็ก ใหม่แน่นอน EnjoyHondaThailand,0
เพิ่มแรงม้า ทางฝุ่น ลุยน้ำ ผ่านได้สบาย สนอร์คเกิลไอรอนแมน ISNORKEL5 Mitsubishi New Triton 5 Ironman x Always with you ไอรอนแมน อยู่กับคุณทุกช่วงเวลา Ironman x ประสบการณ์ช่วงล่าง  ปี ไปได้ทุกที่พร้อมๆกับการท่องเที่ยวของคุณ  Years Ironman x Suspension together with your travel,0
รบกวนถามคับตอนนี้ผมใช้รีโว่เป็นรถห้องเย็นผมรุสึกว่ารีโว่ซดกว่าแชมป์มากๆผมเคยขับแชมป์มาก่อนและมีคนแนะนำว่าให้เราไปจูนกล่องECUใหม่จะให้ประหยัดขึ้นอันนี้จริงเท็จประการรบกวนขอความรู้เพิ่มเติมครับแล้วมีข้อดีข้อเสียอะไรบ้างครับ,2
รักนิสสันครั้งหนึ่งชนกับแท็กซี่ๆเละเลยนิสสันไม่มีรอยเลยคนในรถปลอดภัยทุกคน,1
ขอรายละเอียด yaris ค่ะ,3
เมื่อไหร่จะเอาแอคคอร์ดเขาไทยซะที,0
ดูความเร็วทางตรงอย่างเดียวไม่ได้จริงๆ ครับต้องดูความเร็วทางคดเคี้ยวด้วย jazz vios อาจแหกไปก่อนตั้งแต่โค้งแรกแล้วก็ได้,2
นิสสัน เตรียมเปิดตัว จีทีอาร์ เจ้าของตำนานซูเปอร์สปอร์ตคาร์ อย่างเป็นทางการ ครั้งแรกสำหรับประเทศไทย ในงานมอเตอร์โชว์ ครั้งที่  httpacarnewsonlinecomcarbusinessnissangtr,0
เป็นคนเรียบๆ ง่ายๆ ไม่ชอบสีสันเยอะค่ะ เลี้ยงง่ายด้วยนะ สนใจเลี้ยงข้าวสักมื้อไหม กลมกลืนมากกกกก 55555น้องเพชรชมพูnissan note baengpriklao แบงพริกลาว,2
สำหรับนิสสัน โน๊ต สามารถคลิกอ่านได้ที่ httpswwwnissancothoffersnissannotehtml,0
เครียดสุดก็ค่าน้ำมันกะค่าทางด่วนนี่แหละ โดนแม่ผลัก camry มาให้ขับ คือแบบ แก เงินเดือนเด็กจบใหม่ จ่ายค่าน้ำมัน camry,2
คนบ่นไม่ซื้อ คนซื้อไม่บ่น เจาะความแพง FORD RANGER RAPTOR บ่นกันเยอะเรื่องราคาที่แพงแสบตับ,2
ไครว่าสี Honda บางมั้งคับโดนหินดีดนิดเดียวแม่งลอกเป็นแผ่นเทียบกัน nissan almera อีกคันที่บ้านใช้มา 5 ปีไม่มีแม้กระทั้งรอยหินดีด,1
แล้วแต่จะมองครับ เพราะต้องรอดูการปรับจูนหน้างานอีกรอบว่า ออกจากศูนย์เป็นยังไง อัตราเร่งน่ำมันความทน แต่ถ้าเทียบกับเครื่องเดิมๆ ยาริสกินขาดเรื่องเครื่อง ส่วนมาสด้าได้แต่ประหยัดน้ำมัน เครื่องตัวนี้คงต้องรอดูเทสไดร์รีวิวอีกที ถ้าเครื่องเดิมเกียร์เดิม ผมว่าเป็นรอง,0
เริ่มแล้วนะคะ งานเปิดตัว All New Suzuki Swift  สปอร์ตคอมแพ็กคาร์มาตรฐานระดับโลก ที่โชว์รูมกิจตรงออโตโมบิล ซูซูกิอุบลราชธานี ห้วยคุ้มทางไปอำนาจเจริญ  มาร่วมงานกันเยอะๆนะคะ  ติดตามดูไลท์สดได้ที่เพจนะค่ะ,0
คล้ายๆ yaris ใหญ่กว่านิดนึงแต่ด้านหลังอึดอัดมากแคบด้วยไปดูมาแต่สวย,2
AllNew Toyota RAV เตรียมเปิดตัวที่นิวยอร์กปลายเดือนมีนาคมนี้,0
พอพูดถึงรถยนต์แล่วคิดถึงแฟนเก่าเลยค่ะ อิสัส ออกมาสด้ามาให้กูนั่งเป็นตุ๊กตาหน้ารถได้เดือน ไล่กูลงรถเฉยจ้าาาาา ไม่,2
ราคานี้ คงจะขายยาก เพราะซื้อ คัมรี่ ได้ถึง  คัน,0
เหมือนรีโว่เลยครับ,0
กุญแจ นิสสันมาร์ช สั่นเลยทีเดียว,0
ราคานาทีทองNissan Teana xl ปี,1
จะเอาแรงไปไหนครับเครื่อง ลัมโบเมืองนอกขี่ในเมืองได้แค่ นอกเมือง ทางไฮย์เวย์ ได้ยินแต่เสียงท่อ แต่ก็ไปถึงที่หมาย พอๆกับวีออส,2
ต้องสมัครพันทิปไว้แล้วล่ะ รออ่านดราม่า mazda  ของนี่กับศูนย์ได้เลย,2
นาวาร่าเทียบดีแม็ก,0
Toyota Altis มีขนาดเล็กที่สุด,0
ออกแบบได้ลงตัวมาก ภายในสวยหรูดี ปุ่มไม่เยอะจนตาลาย เครื่องยืดหนุ่นแรงม้าได้แบบนี้ขับมันส์ ทั้งประหยัดด้วย เยี่ยม ราคาล่ะคราวนี้ ถ้ากดลงมาได้สัก ล้านสองกว่า ตัวเริ่มต้น ยันล้านหก ผมว่ามีอนาคตแน่ๆ เพราะ คู่แข่ง ทั้งแคมรี่ แอคคอร์ด ไม่ประทับใจเลย,2
555555555 อาจจะรีจิสเต่อตัวเองลงแอพ เวลาใครต้องการ เหยีบพรีอุสไปเลย,0
ชุดแต่งส่งตรงจากโรงงานของ Nissan Titan ที่หล่อขึ้นเป็นกอง แถมใส่ง่ายใช้เวลาติดตั้งไม่ถึง  ชั่วโมง,1
ชื่นชอบcivicตลอดกาลโฉบเฉียวทุกการขับขี่หลงรักเลย,1
สวยกว่าแคมรี่,0
มีของนาวาร่า D ไหมคับ,0
Dmax G ที่บ้าน 5 ปีเครื่องเดิมๆไม่เปลี่ยนไม่เคยมีปัญหา ซื้อใหม่อีกคันสงสัยคงต้องเอา Dmax กลับมาพิจารณาใหม่,2
ต้องยอมรับเลย Dmaxโฟกัสได้ตรงจุดผู้บริโภค ยอดเลยที่,1
อยากให้ TOYOTA ปรับเรื่องไฟหน้า FORTUNER ด้วยครับไฟหน้า ทำมาได้สุดทีน จริงๆครับเปิดธรรมดาก็แสบตามากพอแล้ว เจอบ้างคันเปิดไฟสูงมาลงข้างทางอย่างเดียวครับ อีกรุ่นครับ MITSUBISHI ปาเจโร ไฟหน้ามาแบบ เพื่อนร่วมทางนี้หงายท้องเลยทีเดียวเชียว มันจะทำให้เจ้าของรถโดนเกลียดขี้หน้าไปด้วยทั้งๆ ทีซื้อมาเดิม เค้าจะมาโดนคนอื่นให้พร ตลอดทางเพราะรถ เอานะครับ,2
ชอบครับ รถในฝันเลยครับ Honda Accord ไปจองมาเรียบร้อยแล้วครับ,1
นึกว่า มาสด้า  น่าจะทำให้แตกต่างสมราคา นะครับ,0
ตูดเหมือนมาสด้าเลย,0
