neu,🚗💨💨 ซิ่งเป็นบางเวลา ซ่อกแซ่กได้ทุกที่ << ขับสนุก ชับมัน ใช่เลย‼️ 👍🏻👍🏻 Honda Jazz>>#Jazz Naja
neu,เรียนถามครับ วีออส ล้อจากโรงงานมีลายนี้ด้วยเหรอครับ รุ่น TRD Sportivo ก็ไม่คุ้นว่าลายนี้ ถ้าใช่ก็ขออภัยครับ พอดีไม่เคยเห็น
pos,Mazda 3 กับ civic hb เบาะนั่งคนขับ ผู้โดยสารตัวไหนนั่งสบายกว่ากันครับ ขับเดินทางระยะไกล
neg,ท้ายรถนั่นอะไรอะ? สัดส่วนมันเหมือนเต่า หรือ ตะพาบ ไรงินะ มันไม่สวย ไฟท้ายทำจะให้สปอร์ต ก็แบบอะไรไม่รู้ กลายเป็นดูไม่มีราคา หน้าทำว่าจะหรูล้ำ ก็ไม่สุดเท่าไหร่ แล้วพอมามอง All New Nissan Altima แล้ว อิ Accord นี่เป็นทวดไปเลย
neu,นโยบายนี้ Ford ใช้มาตั้งนานแล้ว พึ่งรู้ว่า Nissan ใช้ นโยบายนี้เหมือนกัน หึหึ
neu,หน้าตาคล้ายรุ่นพี่รุ่นน้อง !! #Thaicarlover #รถใหม่ #Honda
neg,Nissan CVT-7 ที่เมกา ยืดระยะเวลารับประกันให้เป็น 10 ปี ที่ไทยปล่อยเงียบ คนใช้เองก็เสียงไม่ดังพอด้วย แถมปกป้องรถกันเองอีกต่างหาก
pos,พี่ก้องกับISUZU MU-X 😍😍😋 พี่ต้นก็MU-X หล่อเหมือนกันเลย อิอิอิ
neg,เคยใช้ละยี่ห้อนี้ใช้ได้4ปีขับได้แสนสองพันโลตอนนี้เปลี่ยนกลับมาใช้ยี่ห้อที่เคยใช้ละ ฟอร์ดปัญหาจุกจิกพังง่ายหวยโคตๆ
neu,ขอรายละเอียด Pajero 1399 ดาวน์ 25 ผ่อน 5 ปี
neu,ไปดาวน์ซีวิคสบายใจกว่า
neg,มาสด้าจะแซงฮอนด้าอยู่แล้ว
pos,ชอบมาสด้าสาม
neu,ช่ายคับ รู้สึกว่า honda city ตัวท๊อป ก็มีคับ
neu,"ยอดขายรถยนต์ เดือน มกราคม 61 : MG สามารถทำยอดรวมขึ้นอันดับ 8 ได้สำเร็จ ! และ อันดับ 1 ของแต่ละกลุ่ม ได้แก่ Yaris, Mazda2, Civic, Camry, Sienta, HR-V, CX-5, D-max, Fortuner, H-1 และ Commuter"
neu,D max 1.9 4ประตู ต่อทะเบียน + พรบ กี่บาท Mu x 1.9 พีพีวี ต่อทะเบียน + พรบ กี่บาท รบกวนผู้รู้ครับ
pos,โตโยต้า วิส เท่าไรคับ
neu,มิตซูบิชิปาเจโร่ สำหรับ7ที่นั่ง เป็นรถครอบครั้ว เบาะนั่งกว้าง ขับขี่ปลอดภัย
q,นาวาราแค็ปมีมัยคราบราคาเท่าไหร่คราบ
neu,จริงค่ะ คันเก่า วีออส ซิ้อป้ายแดงมาขับนาน 10 ปี ใส่น้ำยาหม้อน้ำตลอดไม่มีปัญหา เพราะรถใหม่ ถ้าเป็นรถเก่าช่างจะไม่แนะนำให้ใช้ เพราะ จะทำให้หม้อน้ำเป็นรังผึ้ง ช่างแนะนำว่าใช้ได้เฉพาะรถใหม่ค่ะ
neu,ดีแมกออนิวดาวเท่าไรคัฟ
q,ของนาวาร่ามีป่าวคับ
neu,ละลายเลย เวรี่กู๊ด #ToyotaBuzz #MOTORSHOWยกมาที่นี่
neg,นิสสันจะเปลี่ยนโฉมทุก 100ปี ถถถ
neu,แจ๊ส ซิตี้ ซีวิค แอคคอร์ด ซีอาร์-วี
neu,สำหรับ ลูกค้าแอคคอร์ด สุดเอ็กซ์คลูซีฟ ง่ายๆ เพียงคุณมีรถยนต์ ฮอนด้า แอคคอร์ด ปีเก่า ปีใหม่ รุ่นไหนก็ได้ ขอให้เป็นเจ้าของ เท่านี้...ก็มีสิทธิ์เจ้าร่วมกิจกรรม ตามรอยโปร์ ด่วน..! สมัครได้เลย ตามลิ้งค์ ด้านล่างนี้ แล้วพบกันที่ สนามฯ https://www.facebook.com/enjoyhondathailand/posts/10155283369431245
neu,รวมยอดขายทั่วโลก นาวาร่า ก็ไม่น่าจะเยอะกว่า D-max ครับ
pos,นิสสันนาวาราสปอทร์เทคออกรถสันนี้รับดอกเบี้ย0%ฟรีประกันภัยชั้น1แรง แข็งแกร่งใช้แล้วชื่นชอบ
neu,ภาพหลุด!!! Mitsubishi Triton 2018 เวอร์ชั่นบราซิลใหม่ ที่ดีไซน์ต่างจากไทย
pos,ชอบมากๆนิสสัน แข็งแรงทนทาน ประหยัดน้ำมัน กว้างใหญ่ ปลอดภัย ครบทุกความต้องการเลย
neg,ล้อปรกติก็วีดขึ้นครับ ลองสังเกตตอนเราวิ่งตอนฝนตก พอรถเเห้งจะเห็นเลยครับ ตรงนั้นไปโดนมาทีล้อเดิมๆ(วีออส) ต้องค่อยๆคลานไปจนหมดเสียงกระเด็นอ่ะ
pos,55 ไม่น่าจะมีนะครับ ดูไปดูมา นาวาร่ายังดูสวยกว่า
pos,ใช้รถที่เราชอบ อย่าชอบเพราะคนอื่นชอบ ดีแมกก็หล่อดีครับ แต่ผมเลือกรีโว้ เพราะผมเคยใช้วีโก้ มา13ปี ประทับใจมากๆ
neg,นิสสันผ่อนจนเพลียนาวาร่า..
q,จะออกรถโตโยต้าแบบแดงรุ่นcHrแล้วจะขอเปลี่นยล้อเป้นแลนดิกได้รีป่าวคับ
neu,ฟรอ จุน เนอน์ ปี 2012 ตีเทินได้เท่าไรคะ พูดจริงๆๆคะ
neu,TOYOTA YARIS ATIV #phithanbkk
q,ออนิววีออสเท่าไหร่ครับ
neu,เหนว่าเอาชัสซีนินสันนาวาร่ามา
neu,นิสสัน นาวารา ผลิตด้วยเทคโนโลยี่ล้ำสมัย กล้องมองได้ 360 องศา ขับมั่นใจ 100% ฟรีประกันภัยชั้น 1 ดอกเบี้ย 0% พร้อมบัตรเติมน้ำมัน 5000 บาท สนใจทดลองขับได้ที่ศูนย์นิสสันทุกสาขาทั่วประเทศ
neu,เสี่ยจะปันใจไป Nissan แระหรอ
neg,บอกตามตรงว่ารถเก๋งสวยแต่ไม่เคยชอบสายกระบะของนิสสันเลย
neu,Civicพอไดุ้ mazda3 พอคันได้555
neu,สวัสดีค่ะ หากสนใจ โคโลราโด ไฮคันทรี สตอร์ม สี Orange Crush ลูกค้าสามารถสัมผัสตัวจริงและจอง โคโลราโดสีใหม่นี้ พร้อมรับข้อเสนอพิเศษได้ที่งานมอเตอร์โชว์ ตั้งแต่ วันที่ 28 มี.ค. – 8 เม.ย. 61 นะคะ สามารถดูรายละเอียดเพิ่มเติมได้ที่ http://s.chevy.com/58lfy แล้วมาพบกันในงานนะคะ ^_^
neu,จะเอาวีออสไปรับ 5555555
neu,"รถผม D-max 1.9 Blue Power Hi lander ปี 2017 เกียร์ออโต้ อยากยกสูงเพิ่มขึ้น 2"" นิ้ว ต้องใส่อะไรบ้างครับ ราคาเท่าไหร่"
neu,ขอรายละเอียดนิสสันมาร์ชหน่อยคะ
neu,"เวอร์ชั่นไทย มีให้เลือก 4 รุ่นย่อย GA, GL, GLX, GLX Navi (เกียร์ M/T ตามมาทีหลัง) 6 สีตัวถัง : แดง น้ำเงิน ขาว เงิน เทา และ ดำ เปิดตัว 8 กุมภาพันธ์ นี้"
neu,ที่บ้านมีสวิฟแล้ว 1 คัน สมมุติ​ถ้ามีเพิ่มอีกคันขอ ยาริส
neu,เด่นสะดุดตา แต่คงต้องรีบเพราะมีแค่ 250 คัน เท่านั้น !! #Thaicarlover #รถแต่ง #Mitsubishi
neg,ข่าวย้อนหลังมาสด้าเยอะ หลังการขายต้องปรับปรุงอีกเยอะ
neg,จิ๊บๆเงินโยมเอาไปถวายพระแล้วชื้อรถแล้วมันไม่น่าหนักกะบาลใครน่ะ พระชื้อรถเบนช์มีถมเถไป แค่ซีวิคทำเป็นตื่นเต้น อย่าว่าอิจฉาพระน่ะเดียวนี้มันยุคไหนแล้ว ถ้าพระชื้อเครืองบินทนไม่ได้จะไม่ไปผูกคอตายเหรอปลงๆบ้าง
neu,MG6 ขายได้เยอะกว่า Nissan sylphy อีกเหรอ!
neu,ใช้เชฟโคโรลาโด้อยู่ครับ
neg,ดูเหมือนแฮชแบ้ค ดูไปดูมา เอาอีกแล้วพี่โต. เอา ยาริส มาเสียบชัดๆ
neg,แล้วพ่อจะให้หัดตอนกลับตจว.เพราะไม่ค่อยมีรถผ่านแต่เสียวลงคลองมากขอรถที่ไม่ใช่ฟอร์จูนเนอร์ได้มั้ยกลัวใจตัวเอง........
neu,ติดสายถามไหม่อันติสสีขาวครับ
neu,ทำตั้งแต่แรกนี่กิน isuzu ได้เลยนะเนี่ย
pos,รอหน่อยนะมาสด้า 2ขอเก็บตังค์แป๊ป😁😁😁
neg,เอารถเข้าศูนย์ toyotaก็มีโขมยน้ำมัน จับมันไม่ได้ อืม 🙄
neg,ม่ายไหวๆจิงๆ 5555 เอาแอคคอร์ดที่ยอดขายเน่าในเมกา มาจับทุบหน้าทุบตูด ทำไมฮอนด้าออกแบบล้าหลังไงไม่รุ้ ชอบฮอนด้ามาตลอดนะ แต่มันไม่สวยจิงๆอ่ะแล้วแต่คนชอบละกันคับ
neg,ป้ายแดงก้อแค่ยาริส นึกว่าBMW
neg,ใหม่นิสสันนาวาร่ากับก้องรอบทิศไร้กังวลเลยแบบนี้
neg,รถผมรีโว่เปลี่ยนน้ำมันเครื่องรุ่นเก่าให้เฉยเลย
neu,ชุดค้ำนิรภัย Ultra Racing ตรงรุ่น Toyota CH-R ล๊อตแรกของโลก ชุดแรกในไทย ท่านเจ้าสำนัก ศูนย์บริการรถยนต์ครบวงจร Hybrid AutoCar รังสิตคลอง 3 จัดไปครบทุกจุดแล้ว หน้าบน + แพล่าง ชุดเต็ม รอชมรีวิวครับ ================================= CH-Rใครได้รถแล้ว อยากนิ่ง แน่น หนึบ ติดต่อไปเลยคราบ
neu,ขอรายละเอียด โน๊ตกับอัลเมร่า ได้ไหมคะ
q,ขอคำแนะนำหน่อยครับ ยาริสเราใส่แม๊กขอบอะรัยดี ครับ
neg,ถูกศูนย์ Honda กำแพงแสน จ.นครปฐม ย้อมแมวรถไม่ตรงรุ่นและไม่ยอมรับผิดชอบให้ฟ้องศาลเองใครซ...#Honda(รถยนต์)
neu,ชิ้นส่วน B. หายไปค่ะ อยากเอารถ honda jazz มาเข้าสินเชื่อกับทาง Quick Leasing ค่ะ #ควิกลิสซิ่ง #อนุมัติไว #รับเงินไว #ยังไงก็พึ่งได้100%
neu,"ขออนุญาติแท็กนะฝากบอกแชร์ต่อให้หน่อยนะค่ะ ออกรถ กับทางฮอนด้าพระราม 3 สาขาพระประแดง ตั้งแต่ 1-31 มกราคม 2561 พบกับ แคมแปญเดือนมกราคม ♥ กับฮอนด้าช่วยผ่อน สำหรับ jazz city br-v mobilio hr-v เดือนละ 1000 บาท 12 เดือน มูลค่า 12000 บาท ♥สำหรับ cr-v ฮอนด้าช่วยผ่อนเดือนละ 3,000 บาท 12 เดือน มูลค่า 36,000 บาท ♥สำหรับ accord รับฮอนด้าช่วยผ่อนเดือนละ 5,000 บาท 12 เดือน มูลค่า 60,000 บาท ♥สำหรับ accord hybrid รับฮอนด้าช่วยผ่อนเดือนละ 10,000 บาท 12 เดือน มูลค่า 120,000 บาท พร้อมของแถม ♥ฟรีประกันภัยชั้น 1 + พรบ ♥ฟิลม์นิรภัย AESTOMA รับประกัน 7 ปี ป้องกันการโจรกรรม ปาหิน ทุบกระจก กรีดกระจก และที่สำคัญคุ้มครองเข้าประกันภัยรถยนต์ (ราคารวมยอดจัดผ่อนสบายๆ) ♥นำรถเก่ามาเทินกับเราให้ราคาสูงแถมยังได้บัตรของขวัญ 3,000-10,000 บาท ♥ติดปัญหาไฟแนนซ์เราช่วยคุณได้ #โปรดีแบบนี้มีที่ไหนที่นี่ที่เดียวที่ #ฮอนด้าพระรามสามสาขา #พระประแดงเท่านั้น มาเป็นครอบครัว HONDA กับเรานะค่ะ สนใจทักมาได้ค่ะ ชลินี (จิน) ID : jinnyjin1013 099-999-9999"
neu,2.0 ลิตร ของ Raptor เรียกพลังได้ 215 แรงม้า 500 นิวตัน โหดจริงๆ ทีแรกนึกว่า เครื่องนิสสันจะได้ 200+ แล้วนะ ...
pos,TOYOTA FT 86 !! * มุมนี้ อย่างหล่อ
pos,เสียใจที่ไม่มีรูปถ่ายกับรถ เป็นรูปเห็นท้ายรถแทนละกัน จะบอกว่ารถคันนี้เป็นรถคันแรก ชอบมาก เพราะขับแล้วคล่องตัว จอดในห้างสบายๆ ผมเป็นคนตัวเล็ก เลยชอบขับ Jazz ของผมเป็น Hybrid ประหยัดน้ำมันมาก แซงซ้ายขวา อย่างมั่นใจ เคยรถน้ำมันหมดกลางทาง Honda ก็มาเติมให้ อุ่นใจมากครับ รักและขอเป็นครอบครัวฮอนด้าไปตลอดเลยครับ #ฮอนด้าที่รัก #EnjoyHondaThailand
neu,อยู่ที่อู่รึเปล่าครับ มาสด้า2คันเก่าผมโดนชนท้าย ก็แค่3วันเอง อู่นอก ป.1นะ
neu,เผยโฉม นี่คือ Toyota Corolla Altis 2019 เวอร์ชั่น 5 ประตูสำหรับตลาดยุโรป
neu,️suzuki new model ที่เปิดตัวล่าสุดในงาน Motor show 2018 1. รุ่น Sv650x abs ️ทายผลการแข่งขัน BG พบ Police Taro 2. บีจี 3 - 1 โปลิสเทโร
neu,ออกรถยนต์ฮอนด้าวันนี้ รับข้อเสนอสุดพิเศษ ดอกเบี้ยต่ำ พร้อมฮอนด้าช่วยผ่อนนานถึง 12 เดือน ตั้งแต่วันนี้ – 30 เม.ย. 61 ที่โชว์รูมกระบี่ฮอนด้าทั้ง2สาขา รายละเอียดเพิ่มเติม คลิก
neg,โอ้ยย...เสียดายเอาเงินไปจองรถหมดล้าววววันนี้😂
neu,แค่ผู้หญิงขับวีโก้
neu,CHRรวมเทคโนโลยีสกายไลน์ของ cx3 หรือยังตอนนี้ ตอนนั้นเห็นมีข่าวจับมือกันกับมาสด้าและโตโยต้า แบ่งปันเทคโนโลยีกัน
neu,ฮอนด้า ซีวิค แฮทช์แบ็ก ใหม่คือคันที่นับจากซ้ายมือคอลัมน์ที่4 แถวที่ 5 ค่ะ
neg,ลูกสูบของวีออสไม่ได้ออกแบบมาเพื่อติดแก้ส lpg ก็มีคนเอาไปติดแก็สไม่เกินปีลูกสูบมีปัญหาแน่นอน แต่โคโรลล่า เขาออกแบบมาเพื่อติดแก็สได้ มีทั้งติดตั้งที่โรงงานเลยและติดตามข้างนอก ถ้าเอาviosไปติดหมดประกันศูนย์แน่นอน ราคาซ่อมและเปลี่ยนลูกสูบก็หลายหมื่น แต่โคโรล่าเขาเกิดมาเพื่อสิ่งนี้
neu,ว่าจะสั่งมาลอง แต่นิสสันเทียน่า j32 กดซวิตส์ on กดคันเร่งแล้วลิ้นไม่เปิด ทำไงได้บ้างคับ ไม่งั้นมันล้างได้ด้านเดียว
neu,สวยพอไหม? ภาพร่าง Toyota Altis 2019 ใหม่ โดยนักออกแบบอิสระ จับเอาหน้า Auris มาใส่ตัวถังซีดาน
q,ยาริสปี2007ไมค์100000ต้องทำการเปลี่ยนอะไรบ้างครับ
neu,All new Almera พองลม
neu,ผมได้จอง CX5 หลังจากเห็นข่าวการฟ้องร้องลูกค้า ผมก็ย้ายไฟแนนซ์ไปซื้อฟอร์จูนเนอร์ทันที ประกับกับ Mazda2 ดีเซลผมก็ยังซ่อมไม่หายเลยไม่ขอเสี่ยง.
neu,ชม Nissan GT-R เครื่องยนต์วางกลางในจินตนาการ
neu,สามารถดูราคา MG GS ในเว็บไซต์ตามลิงค์นี้ได้เลยครับ :) http://mgcars.com/th/mg-models/mggs/detail/price
neu,ได้รุ่นซื้อขายเลยครับนานๆไปขาย Yaris รุ่นปลา กระโห้ ครับ สำหรับเต็นท์มือสองเรียกได้เลย55555
neg,X trail หรือ Rogue รถ suv ที่ขายดีที่สุดในโลก แต่ nissan ไทยดูเหมือนไม่อยากจะขาย เปิดตัวก็ช้า การตลาดงงงวยมาก
neg,รุ่นนี้ราคามือสองไม่กี่แสน ถูกกว่าอัลติสอีก
neu,เว่าอิสานให้ฟังแหน่ #ToyotaBuzz #MOTORSHOWยกมาที่นี่
pos,1.9 ไปทำมาขนาดนี้ จากเดิมแค่150ม้า ไปทำมาซะเยอะ 185ม้า แต่นาวาร่าเดิมๆ ไม่ต้องไปแต่งอะไรก็จัดมาให้190ม้าครับแบบไม่ต้องดิ้นให้เหนื่อย เครื่องไปทำมาแล้ว มาเกทับผมว่ามันตลกครับ จริงๆห่างกันแค่5ม้า ตามหลักทฤษฎีแล้วแทบไม่รู้สึกถึงความต่างเลยครับ รถผมเสียเงินซื้อมาได้รถที่พร้อมใช้งาน แต่รถคุณรถตลาดค่าตัวที่แพงกว่า แต่ต้องต้องจ่ายค่าของแต่งเพิ่มอีกหลายรายการเพื่อที่จะว่าให้วิ่งทัน แล้วบอกไม่ต้องทำไรมาก เปลี่ยนกล่องใหม่ เปลี่ยนเทอโบใหม่ เปลี่ยนแคมใหม่ (ท่อก็ต้องเปลี่น)ทำมาขนาดนี้ถ้าบอกไม่เปลี่ยนก็เสียเวลาเปล่าถูกมั้ยครับ จากรถที่ได้ชื่อประหยัด (คงไม่ประหยัดซะแล้วละครับ) ถ้าคนเค้ามีความคิดที่เป็นกลาง เค้าก็คงรู้แล้วครับว่าค่ายไหนหน้าใช้กว่ากัน ขอโทษสมาชิกด้วยครับที่เขียนเยอะ แต่ผมฟังเค้าตอบแล้วตลก และขัดความรู้สึกมากครับ..
neg,ปกตินั่งแต่มิวเอ็กจะเหยียดขายังไงก็ได้พอมานั่งซีวิคแล้วแปลกๆหัวก็ไม่ได้ติดนะแต่รู้สึกรถคับแคบไปหมดเลย😂
neu,มีบัตรเข้าชมมอเตอร์โชว์ ที่อิมแพคเมืองทองแจกมั้ยคะ. สนใจ ชม รถ Honda ในงานค่ะ
