neu,🚗💨💨 ซิ่งเป็นบางเวลา ซ่อกแซ่กได้ทุกที่ << ขับสนุก ชับมัน ใช่เลย‼️ 👍🏻👍🏻 Honda Jazz>>#Jazz Naja
neg,เป็นการตอบคอมเม้นที่ดีที่สุด โตโยต้าอึด ทน ขนเยอะ ฮอนด้าอะไหล่แพง แล้วก้อไม่เหมาะเพราะศูนย์บริการน้อย ฮอนด้าเหมาะกับใช้งานแบบลูกค้าที่เปนการใช้งานส่วนตัว ไม่เหมาะกับเชิงพานิชย์เครื่องเค้าอึดสู้โตโยต้าไม่ได้
pos,นาวาร่าเอาเรื่อง😘
neu,สำหรับโตโยต้า ได้แค่นี้
neu,งานเปิดตัว All New Suzuki Swift
pos,มิตซูในดวงใจตลอดมา Lancer EXและก็ยังคงเป็นเพื่อนเดินทางทีดีเสมอครับ ขับมา 4 รุ่นแล้วครับสำหรับ Lancer รักไม่ยอมเปลี่ยนแปลง
neg,จ๊ะ จ๋า ผมว่าขนาดล้อใหญ่กว่าซีวิค เสียงก็ย่อมดังกว่าเป็นธรรมดานะ(เดิมใช้ซีวิค12)ครับ
neu,เจเนอเรชั่นใหม่ หลุดโฉมแฮทช์แบ็คเต็มๆ ตา มาพร้อมบุคลิกที่สปอร์ต ทันสมัยยิ่งขึ้น
neu,ใช้งานได้เอนกประสงค์ ดีไซน์สวยหรูจากภายนอกสู่ภายใน ฟังก์ชันในรถครบครัน ซื้อตอนนี้นับข้อเสนอสุดพิเศษคะ ใครทีต้องการรถที่สวยและใช้ประโยชน์ครบครัน เลือกเลยคะ 💞
neu,ไม่มีใบขับขี่ไม่ชอบความเรว โฆษณาฮุนได ขับรถในเอมวี กลัวไก่ โฆษณาไก่ทอด กินกาแฟแร้วขมจนไอ โฆษณาโคลัมบีน่า อ่อนหัดไอทีเปลี่ยนรูปโปรยังทำไม่เปน แสดงนำgamedev อ่านภาษาฝรั่งเศสไม่ออก ต้องทำเปนอ่านออกในเอมวี ไม่ถือกระเป๋า โฆษณากระเป๋า ไม่ดื่มแอลกอฮอล โฆษณาโซจู ทั้งหมดเพื่อปากท้องรู้ก
neu,ความแตกตื่นที่งาน North American International Auto Show ได้เกิดขึ้นเมื่อ The All-New Toyota Avalon รุ่นปี 2019 เปิดตัวในงานค่ะ
pos,งง เหมือนกัน รถผมแค่วีออส หลับในชนท้ายกระบะ ถุงแตกสองใบ ผมออกมาเดินเฉย ไม่เป็นไรเลย
neg,"สามปีที่แล้วผมไม่ซื้อ teana ไปออกaccord แทนก็เพราะ interior นี่แหละ รับไม่ได้จริงๆ ปลายปีกะจะเปลี่ยนรถอีกคันเป็น SUV เพราะไปต่างจังหวัดทีไร6คนนั่งไม่หมด ต้องขับสองคัน ก็มอง pajero กับ terra ไว้นี่แหละ (ตัดEverest เบาะหลังโคตรชัน นั่งไม่ได้,ตัดfortuner นั่งแล้วจะอ้วก) ข้างนอกก็สวยดีนะ แต่เจอภาพinterior เข้าไปพูดตรงๆ โคตรเซ็ง อารมณ์ประมานเจอสาวสวย แต่เปิดกระโปรงมามี k_y อะไรแบบนั้นอะ"
neu,ถอยรถให้คนละคันเอาป่ะ
neu,ร่วมสนุกกับ Toyota Buzz #น้องบัสซี่ #buzzy #น้องรถบัสส์
pos,ถ้าเทียบกับ Prius 0-100 11.07 sec 80-120 8.54 sec Fuel cons. 18.94 km/L เรื่องสมรรถนะ ไม่แปลกใจที่แย่กว่า Prius เพราะไปลดสเปคมอเตอร์ลงมา แต่เรื่องความประหยัดนี่มีประเด็น น้ำหนัก Prius ประมาณ 1.4 ตัน CHR หนักกว่านิดหน่อย แต่ด้วยรูปทรงและขนาดล้อ CHR ทำได้ตั้ง 20.21 หรือเพราะว่าเร่งได้ไม่ไวเลยไม่ค่อยซด 5555555555
neg,แล้วรถบ้านทั่วๆไปแบบ civic vios camry เสียภาษีแบบไหนบ้างครับ แบบไม่รู้จริงๆ
neu,นิสสัน นำรถซูเปอร์สปอร์ต นิสสัน จีที-อาร์ พรีเมียม อิดิชั่น 2018 และรถยนต์พลังงานไฟฟ้ารุ่นใหม่ ยลโฉมในมอเตอร์โชว์ 2018 http://acarnewsonline.com/carbusiness/nissan-motor-show-2018
neu,รถไฮลักซ์ รุ่นที่หายไป คือ TOYOTA Hilux Revo รุ่น Rocco 4 ประตู ข้อ (D) Rocco ค่ะ
neu,ใช้พื้นฐานเดียวกับ Civic FC เบนซิน 1.5 Hybrid + มอเตอร์ไฟฟ้า 2 ตัว ปรับหน้า - ท้าย ภายในให้ต่างกัน (หรือเข้าใจง่ายๆก็คือ Civic FC Hybrid นั่นเอง)
neu,แถวที่ 5 คันที่ 4 คือ ฮอนด้า ซีวิค แฮทช์แบ็ก #EnjoyHondaThailand
neu,30%เป็นเงินเท่าไหร่YARIS
neu,"ของMazda3 เพิ่ม15,000 นะครับ #แดงพิเศษ ไม่ใช่แดงอะไรก็ได้"
neg,ยังรั่วน้อยกว่าหลังคา MG3
neu,ลิ้นหน้าyaris2009มีไหมคับ
neu,ไฟท้ายนี่ซีวิคชัดๆ
neg,เดี๋ยวโดนhondaชื้อคืนบ้านคุณพ่อคุณแม่สิ ไปเชื่ออะไรมามันคนบางกลุ่มคิดว่าเป็นรถเทพทำ taxi ไม่เหมาะก็เลยนั่งเทียนเขียนข่าวขึ้นมาเว้ย เข้าใจมั้ย honda ไม่มีสิทธิ์ไปชื้อคืน กรุณาทำความเข้าใจใหม่เสียบ้าง
neu,ถามหน่อยครับ สามารถดัดแปลงวีโก้แชม2012 ใส่หน้ารีโว้ตัวใหม่ได้ไหมครับ
neu,"ใหม่ ปี 2017 รถแฮตช์แบ็ก 5 ประตู ขวัญใจวัยรุ่นด้วยรูปทรงปราดเปรียว สไตล์สปอร์ต ตัวถังใหม่ครั้งแรกในไทย . มาพร้อมเครื่องยนต์ขนาด 1.5 ลิตร VTEC Turbo พัฒนาภายใต้เทคโนโลยีเอิร์ธดรีม ให้กำลังสูงสุด 173 แรงม้า ที่ 5,500 รอบ/นาที ด้วยแรงบิดสูงสุดที่ 220 นิวตัน-เมตร ที่ 5,500 รอบ/นาที ซึ่งเทียบเท่ากับเครื่องยนต์ขนาด 2.4 ลิตร แต่กลับมีอัตราการประหยัดน้ำมันที่ดีกว่า มาพร้อมดีไซน์พรีเมียมสปอร์ตตามสไตล์รถยุโรป ด้วยโครงสร้างตัวรถที่กว้าง และมีความสูงที่ต่ำลง ให้อารมณ์ความรู้สึกของการขับขี่แบบสปอร์ต และมั่นใจ . Honda Civic 1.5 Turbo Hatchback ใหม่ ปี 2017 มีพื้นที่ภายในห้องโดยสารที่กว้างขวางยิ่งขึ้นใกล้เคียงกับรถยนต์ในระดับ D Segment ทั้งยังครบครันด้วยเทคโนโลยีระดับพรีเมียม . บวกกับเทคโนโลยีความปลอดภัยอันล้ำสมัย ด้วยระบบเบรกมือไฟฟ้า (Electric Parking Brake) และระบบ Auto Brake Hold (Automatic Brake Hold) ระบบหัวฉีด ไดเรคท์ อินเจคชัน และท่อไอดีแบบตรง ระบบการควบคุมการเปิด-ปิดวาล์วแบบคู่ (Dual VTC) ของท่อไอดี และท่อไอเสีย เทอร์โบ ชาร์จเจอร์ ที่มีระบบควบคุมช่องระบายไอเสียส่วนเกินด้วยไฟฟ้า ให้สมรรถนะการขับขี่ที่เหนือกว่าเครื่องยนต์ทั่วไป และมีอัตราการประหยัดน้ำมันดีเยี่ยมทุกสภาพการขับขี่"
neu,นิสสัน นาวารา ปิคอัพล้ำสมัย มีกล้องมองภาพรอบทิศทาง ออกวันนี้ ดอกเบี้ย0%
q,- น้ำมันเครื่อง ทั้ง Fully / Semi เบนซิน - น้ำมันเกียร์ CVT - ตั้งวาล์ว (Honda) - ล้างลิ้นปีกผีเสื้อแบบถอดล้าง สลิง / ไฟฟ้า - หัวเทียนทุกเกรด คาร์บอน / เข็ม / Iridium - ช่วงล่างต่างๆ โช๊คอัพ ลูกหมาก บูช - สายพานเครื่อง ทำตามนี้ ประเมินราคาหน่อยครับ Honda city cng 2014
neu,ผมว่าอยู่ที่คนขับด้วยแหละครับ ผมขับรถที่บ้าน3คัน ถ้าทางไกลก็ได้เกิน20ทุกคันนะครับ นิสสันมาร์ชMT กรุงเทพ-ชุมพร 23โล/ลิตร มาสด้า2 กรุงเทพ-ปราจีน-กรุงเทพ 25โล/ลิตร ล้าสุดเอาซิตี้ไปชะอำ ได้24โล/ลิตรครับ
neu,": นิสสัน ลีฟ ใหม่พร้อมจำหน่ายใน 7 ประเทศเอเชียและโอเชียเนีย New Nissan LEAF to go on sale in 7 markets in Asia and Oceania Icon of Nissan Intelligent Mobility will be introduced in Australia, Hong Kong, Malaysia, New Zealand, Singapore, South Korea and Thailand; Nissan exploring launch in Indonesia and Philippines"
q,ขอรายละเอียดโปรโมชั่น ส่วนลด mazda 2 1.3 หน่อยค่ะ
pos,เซฟโรเลตจัดไหม
neu,เดี๋ยวติ่งฮอนด้าก็ออกมาว่าเลียนแบบอีกทั้งที่พลีอูสไฟท้ายซีวิกน่าจะเอาก๊ิบปี้อย่างสวย
neu,มีของนิสสัน jukeป่าวครับราคา
neu,ที่สุดแห่งออฟโรด เครื่องแรง ช่วงล่างปึ้กตามแบบฉบับ Ford Performance
neu,มาสด้าเปิดตัวกระบะใหม่ยอดรวมอันดับ1แน่นอน
pos,Toyota Celica GT-Four (ST205) - น่าเล่นมั๊ย !? ข้อมูลที่ต้องรู้จากคนเล่นจริง : Auto Collectibles
pos,เยี่ยมไปเลยtoyota
neu,รถยนต์ NEW MG ZS รุ่น C ไม่มี i-SMART System รุ่น X มีหลังคา Sunroof ครับ สามารถดูรายละเอียดเพิ่มเติมในเว็บไซต์ตามลิงค์นี้ได้เลยครับ :) http://mgcars.com/th/mg-models/mgzs/detail/compare
neg,ผมใช้อยู่2.4 ประหยัดมากครับ เปรียบเทียบกับที่ใช้วีโก้มา รีโว่ประหยัดกว่าเยอะ
neu,มีรถ3คันมิวเอ็กเครื่อง2500ขายทิ้งเมื่อวานโตโยต้าแคมรี่เครื่อง2400ขายทิ้งวันนี้เหลือยาริสเครื่อง1200ไว้ใช้คลานไปค่ะโดนใบสั่งความเร็วเดือนละไม่ต่ำกว่า3-4ใบไม่ใหวจ่ายจริงๆค่ะยิ่งสระบุรีกล้องเยอะมากปรับใบละ1000ขายทิ้งแมร่งจะได้ไม่โดนรีดไถแมร่งเกิน92แมร่งใบสั่งมากูยอมขับเครื่อง1200ดูดิกูจะโดนใหมไม่ได้แดกเงินกูอีกต่อไปนี้ตะกวดริมทาง
pos,ต้องรุ่นนี้เลยครับ Honda Civic มันเป็นรถที่มีเสน่ห์มากๆ ผมไปเดินงาน MotorShow ทีไรต้องมองและเข้าไปลองสัมผัสทุกที แต่ยังเก็บเงินซื้ออยู่ครับ รุ่นนี้บอกเลยผมต้องซื้อมาขับเป็นคันแรกแน่นอน (ขอเก็บเงินอีกหน่อย ใกล้แล้วๆ) ปล.ไม่มีภาพคู่กับรถ แต่อีกไม่นานครับ ฝันน....ให้ไกลไปให้ถึง #ฮอนด้าที่รัก #EnjoyHondaThailand
neg,Civic น่าใช่กว่ายาริสนะคะ ลองมาดูก่อนได้นะคะ ลาดพร้าว 22 ค่ะ
neu,"17-18 มีนาคมนี้ ไม่ต้องรอให้ถึงงาน #MotorShow ก็รับ #โปรโมชั่นมอเตอร์โชว์2018🇹🇭ได้ทันที แค่ลูกค้าจองรถกับเราที่ #โชว์รูมนิสสันบางนา(กม.4) ✔ดาวน์ต่ำ4,999* ✔ผ่อนสบาย3,330** ✔ดอกเบี้ย0%*** ✔ฟรีประกันภัยชั้น1ทุกรุ่น #MARCH #ALMERA #NOTE #SYLPHY #TEANA #NAVARA #XTRAIL 🔻🔺️🔻🔺️🔻🔺️🔻🔺️🔻🔺️🔻🔺️🔻🔺️🔻🔺️ 📌#รถใหม่ป้ายแดง 📌#ดาวน์น้อย 📌#ผ่อนสบาย 📌#โปรโมชั่นดีดี 📞 โทร 02-222-2222 (ฝ่ายขาย) 📌#สยามนิสสันเซลส์ 📌#สาขาบางนา(กม.4)"
neu,4ประตู toyota หนี ford ไม่ห่าง แนวคิดคนใช้รถเริ่มเปลี่ยนไปไม่ยึดติดยี่ห้อแต่คิดถึงความคุ้มค่าและความปลอดภัยกับชีวิตมากขึ้นนะ
neu,ใหม่ กระบะพันธุ์ลุยจาก Arctic Trucks เตรียมลุยตลาดอังกฤษ
neu,มันคือ Mitsubishi GC-PHEV Concept ที่เอามาขัดเกลาใหม่
neu,🚗”ถ้าเราไม่ชนเขา เขาก็ชนเรา” อุบัติเหตุเกิดขึ้นได้ตลอดเวลา 📌การันตีมาตรฐาน #ความปลอดภัยสูงสุด ระดับ 5 ดาว 🌟🌟🌟🌟🌟 #เอทีฟ และ #ยารีส 📩 สอบถามได้ที่ https://m.facebook.com/msg/toyotaphrae/ หรือ https://line.me/R/ti/p/%40toyotaphrae #แพร่หล่อตระกูลขายโตโยต้า #ซื้อโตโยต้าต้องมาที่ #โตโยต้าแพร่หล่อตระกูล #Yaris #ATIV
neu,ไม่ตายหลองคนับDmaxมันขายได้ยุแล้ว ราคาเริ่มต้นล้านห้าอัป
neu,ไปจองมาแล้วนาจา Mitsubishi Attrage ได้หลังสงกรานต์เลย รอขับอยู่นาจา กระทัดรัด เหมาะกับสาวๆขับรถคนเดียวแบบเรา ราคาสบายกระเป๋า ประหยัดน้ำมัน วิ่งไกลแค่ไหนหายห่วงค่ะ
neu,ดีแม็กตอนครึ่งปี2011 ตัวท๊อป ทำประกันชั้นหนึ่งเท่าไร
neu,สามารถดูราคารถยนต์ New MG ZS ตามลิงค์นี้ได้เลยครับ:) http://mgcars.com/th/mg-models/mgzs/detail/price
neu,ได้เลยครับ คุณลูกค้าสามารถเข้าไปอ่านรายละเอียดข้อเสนอสุดพิเศษของ Nissan Navara ได้ที่นี่เลยครับ https://www.nissan.co.th/offers/nissan-navara.html
pos,Honda Civic ห้าประตูสีแดงสดสวยมากเลยครับ น่าสนใจจริงๆ
pos,นิสสัน อัลเมล่า ถายในกว้างใหญ่ นั่งสบายภายนอกสวยงาม ราคาไม่แพงประหยัดน้ำมันสุดๆ
neu,1.สีบรอนเงิน 2. นิสสันจู้ค ทะเบียน 527 ขอนแก่น 3.7194
neu,ของผมพฤกษ์ลดา ข้างบ้านมี vios 1 คัน CRV 1 คัน รถตู้ 1 คัน ฟอจูนเน้อ 1 คัน มอเตอไซด์ 2 คัน เวลาจอดในบ้าน ก็vios และ รถมอเตอไซด์ ที่เหลือก็ข้างนอก ริมฟุตบาทเลยจ้า แต่เค้าก็ยังมารยาทดีนะ ฟอจูนเน้อที่ปีนขึ้นฟุตบาทเลยจ้า 555 แต่โชคดีครับ ที่คนแบบนี้ไม่ค่อยเยอะ เลยไม่มีปัญหาอะไรมาก แค่บ่นๆ ด่าๆ แต่ไม่กล้าว่าตรงๆ แค่นั้น 55555
neu,นิสสัน นาวาร่า 😌
neg,วีออส!!!....เจอแบบนี้บ่อยไปแล้ว ชักเริ่มกลัว เข้าศูนย์ด่วน!!
neu,นิสสัน เทอร์รา รุ่นใหม่ เตรียมเปิดตัวในประเทศจีน ช่วงฤดูใบไม้ผลิปีนี้
neg,ดับครับ สำหรับ D-seg ของนิสสันในไทย ทั้งที่รถมันดีมากนะ นอกจากการตลาดของบริษัทจะห่วยแล้ว พวกโชว์รูมรถก็ห่วยครับ ขนาดโชว์รูมใหญ่ประจำจังหวัดนึงในภาคเหนือยังมีรถมาโชว์ไม่ครบเลย เทียน่าเนี่ยไม่มี รถ suv ก็ไม่ที มีแต่รถเล็กกะซิลฟี่ ห่วยอ่ะ บอกตรง
neu,มาสด้า2 ได้24โลลิตรนี่ไม่ค่อยเท่าไหร่ แต่ที่ไม่สบายใจมากๆคือ yarisตัวเก่า ทำไมสปีดดีเวอร์ อันนี้สงสัยสุดๆ 🤔🤔🤔
pos,ถ้าไม่มีเรนเจอร์โมเดลปี2012 ฟอร์ดประเทศไทยจบเห่ไปแล้ว
pos,เพิ่งออก JAZZ มาเมื่อ 2 /2/61 ค่ะ ขอแนะนำ คุณปุ๋ย Honda อุดมสุขค่ะ โทร 066-6666666 ประทับใจตั้งแต่วันที่เข้าไปดูรถเลย
neu,ทำมัยต้องปาเจโร่ เอเวอเรสต์ก็มี มิวเอ็กซ์ก็มี ฟอจูนเนอร์ ก็มี ค่ายอื่นเค้าน้อยใจนะ
neu,แท็กซี่ส่วนบุคคลนี่ ฟอจูนเนอร์ ตัวใหม่ 1.5 m เห็นหลายคันอยู่ แถวสุวรรณภูมิ นับประสาอะไรกับ ซีวิค 900k ( ถ้า สหกรณ์เหมาไปทำหลายสิบคันก็ไปอย่าง)
neg,‘มาสด้า’ ออกโรงชี้!! สาเหตุที่ฟ้องร้องเรียกค่าเสียหายจากลูกค้า 95 ล้านบาท ชัดเจน
neu,ขอข้อมูล แอคคอร์ด ราคาหน่อยครับ ตัวทอป
pos,กระบะนิสสันนาวาร่า..ช่วงล่างแกร่งมากครับ
q,โตโยต้า รีโว้นี้หรูแล้วหราา
pos,Honda Jazz เหมาะกับไลฟ์สไตล์การใช้ชีวิตจริงๆ รูปลักษณ์โฉบเฉี่ยว สวยโดนใจ
pos,ดีพอใจมากครับ เบรคนุ่มไปไกลๆมาแล้วเบรคมั่นใจ ขับไม่เกิน 130 ผมเปลี่ยน 4 ล้อเลยนะ Honda Civic FB เปลี่ยนน้ำมันเบรคด้วยครับ
neu,ดีแม๊กคันหล้งคับดาวเท่าไรคับ
neu,ยึดโรงงานอีซูซุ ยึดโรงงานฮอนด้า ให้มาเป็นผลิต nissan navara 2.3 dci turbo 190 HP 4WD 7AT
pos,นิสสันนาวารา มาพร้อมกับนวัตกรรมใหม่ กล้องมองรอบทุกทิศทาง เพิ่มความปลอดภัยในการขับขี่ น่าสนใจมากๆค่ะ
neu,toyota มันอาจจะคิดว่า ตัวฟอจูน คงบรรทุก ไม่เท่า Revo เพราะมันสายกะบะ มันจำเป็นกว่า แต่มันลืม ไปว่า ฟอจูนนั่ง 2 คนตูดมันยังห้อย คอนเซ็ปฟอจูน ตูดห้อยหน้าลอย
neg,เราขับ crv ไม่เตี้ยนะ .... ไฟฟอร์จูนเนอร์ยังทิ่มตาเราทะลุได้เลย ㅠㅠㅠㅠㅠ X3 ก็ไม่เตี้ย กระจกมองหลังรอดเพราะมันเบลนเขีย…
pos,Teana รถดีนะ ผมเคยใช้ J32
neu,TOYOTA รุ่น C-HR
neu,แปลว่า.นิสสันมาร.ก็ไปได้ซิครับ
neu,เท่าวีออส คุ้มมาก
