review,sentiment
สวัสดีค่ะ สำหรับกะบะ MY จะเป็นโคโลราโดเซนเทนเนียล อิดิชั่น เป็นโคโลราโดรุ่นพิเศษที่ผลิตมาเพื่อเฉลิมฉลองวาระครบรอบ  ปีของรถกระบะเชฟโรเลต โดยแต่ละคันจะได้รับการประทับหมายเลขประจำตัวรถบนประตู โลโก้โบว์ไทฉลองครบรอบกระบะ  ปี ตราสัญลักษณ์ฉลองครบรอบกระบะ  ปี สติกเกอร์สีดำรุ่นพิเศษด้านบนฝากระโปรงหน้า และล้ออัลลอยสีดำขนาด  นิ้ว และการตกแต่งเป็นพิเศษอื่นๆ ซึ่งคุณสามารถเข้าชมรายละเอียดเพิ่มได้ที่ httpschevycomcws ค่ะ,0
พลังอัจฉริยะที่ขับเคลื่อนสู่ชีวิตยุคใหม่ใน นิสสัน เอ็กซ์เทรล ไฮบริด คือ INTELLIGENT HYBRID ข้อดีของการมีเทคโนโลยีนี้คือ  เครื่องยนต์ ระเบิดเต็มพลังสมรรถณะในขณะเร่งด้วยการเสริมกำลังจากมอเตอร์ไฟฟ้า  คลัตช์ ให้อัตราเร่งเร็วกว่า ด้วยการออกแบบให้มีการสูญเสียกำลังน้อยกว่าระบบที่ใช้ทอร์คคอนเวิร์ตเตอร์  แบตเตอรี่ ส่งพลังงานที่ชาร์จกลับได้ในระยะเวลาอันรวดเร็ว เพิ่มช่วงการทำงานของมอเตอร์ไฟฟ้าให้มากขึ้น  มอเตอร์ มอเตอร์ไฟฟ้าเพียง  ชุด ทั้งการขับขี่และการชาร์จไฟกลับ ช่วยให้รถมีน้ำหนักเบา,0
พลังที่ขับเคลื่อนสู่ชีวิตยุคใหม่ ที่ให้คุณได้มากกว่า ด้วยระบบ HYBRID อัจฉริยะทรงประสิทธิภาพ ให้คุณใช้มอเตอร์ไฟฟ้าได้ถึงความเร็วสูงสุด  กมชม เต็มสมรรถนะ เปลี่ยนประสบการณ์ใหม่สู่ Intelligent SUV วันนี้ รายละเอียดเพิ่มเติม บริษัท สยามนิสสัน พิษณุโลก จำกัด สำนักงานใหญ่ 55555555,0
นิสสัน เทอร์รา อดใจรออีกนิด,0
เปิดตัว นิสสัน นาวารา ซิงเกิ้ลแค็บ WD ใหม่ ปิคอัพอัจฉริยะพลังแรงการบรรทุกหนักที่ลุยได้ทุกเส้นทาง httpacarnewsonlinecomnewcarnissannavarasinglecabwd,0
ทับทิมกันชนด้านหลัง vios ยิ่งหนักเลย เอาไฟไปใส่ทำไม แสบตาสุดๆ,2
มาสด้า เลอดิส คลองหลวง ALLNEW MAZDA CX5 ให้คุณสัมผัสมุมมองใหม่ที่เหนือกว่า มั่นใจไปกับทุกความแรงที่ควบคุมได้ AllNewMazdaCX5 MazdaThailand,0
นิสสันทำการตลาดล่าช้ามาค่ายอื่นขายกันเกลื่อนนิสสันเพิ่งจะเริ่มเข้าใจองค์กรใหญ่แต่ไม่ถูกใจสาวกนิสสันในไทยเลย,2
หลุด Mitsubishi Triton  เวอร์ชั่นอเมริกาใต้ ปรับดีไซน์ต่างไม่เหมือนของไทย,0
มีนิสสันซิลฟี่หรือไม่ครับ,3
Mazda มีเเบบนี้บ้างไหมครับ,0
ทำไมข้างหน้าดูแล้วมันนึกถึง Suzuki celerio,0
รุ่นใหญ่จากเชฟโรเลต เชฟโรเลต คามาโร่ รถสปอร์ตอเมริกันอันดับหนึ่ง,0
ชอบ Honda Jazz คะ เหมาะกับผู้หญิงอย่างเรา เป็นรถยอดนิยม เกียร์ออโต้ ขับสบาย เบศูนย์อยู่ใกล้บ้าน เป็นศูนย์ใหญ่ ซ้อมเร็วครบ วงจร และบริการดี ข้างในกว้างเยอะมาก ของแต่งเยอะ ค่าบำรุงรักษาไม่แพงมากกก คะ ฮอนด้าที่รัก EnjoyHondaThailand,1
สนม่ะ รึจะรอ pajero,0
ครับ ไอดีไล nissanmsk,0
ยนตรกรรมล้ออัลลอย  ICONIC CROSS ของ The New Isuzu MUX ทำให้เป็นไลฟ์สไตล์ความต้องการของผู้ใช้รถที่มีสไตล์อันโดดเด่น ไม่ซ้ำใคร อดใจรอไม่ไหวจริงๆ พร้อมให้คุณเป็นเจ้าของแล้ววันนี้ ณ โชว์รูมอีซูซุพระนคร ทุกสาขา ทั่วประเทศ อีซูซุพระนคร isuzuphranakorn อีซูซุ isuzu bluepower ดีแมคซ์ dmax บลูเพาเวอร์ มิวเอ็กซ์ mux,0
อยากลองเอา mitsubishi mirage เอาไปขับลุยให้สนุกสุดมันส์ตั้งแต่ เชียงราย มาถึง หาดใหญ่ ใน  วัน มันต้องน่าสนุก มันส์ มากๆ แน่เลย,0
แต่โตโยต้าผลิตไม่ทัน อัลติส เริ่มได้แปดแสน chr เกือบล้าน,0
มาแว้ววว AllNew Ford Focus โฉมใหม่ ที่เห็นนี้เป็นตัวถัง Sedan นะครับ ซึ่งรุ่น 5 ประตูแฮทช์แบ็คจะมีหน้าตาที่แตกต่างกัน ดูตัวแฮทช์แบ็คในโพสต์ถัดไป มีเครื่องยนต์เบนซิน EcoBoost เทอร์โบ  กับเครื่อง 5 ลิตร และเครื่องยนต์ดีเซล 5 ลิตร และ EcoBlue  ลิตร พร้อมเกียร์อัตโนมัติ  สปีด ที่มา httpsmotoruolcombrnewsnovofordfocusapresentacao,0
ถ้าไม่ออกรถฟอร์ด เรนเจอร์ mc  ผมก็จะออกแร็พเตอร์ เน้นกระบะบรรทุกของได้นิดหน่อย สี่ประตู ไม่เคยมองเอเวอร์เลสเลย,1
mazda  สีใหม่มั๊ยครับ,0
มาสด้าทุ่มงบลงทุน  ล้าน เปิดโรงงานในไทยผลิตเครื่องยนต์ใหม่ เพิ่มกำลังการผลิต  เครื่อง เตรียมส่งออกไปทั่วโลก,0
นิสสันมาแหะ,0
มองผ่านๆนึกว่า Toyota Supra เหมือนเอา Jza มาพลาง,0
ใครที่กำลังมองหารถยนต์คู่ใจ อย่าลืมแวะมา ที่ โชว์รูม มิตซู เตชอัมพร นะค่ะ ต้อนรับเมษา  คุ้มค่ามากกว่าใคร ด้วยโปรโมชั่นร้อนแรง กับ มิตซู เตชอัมพร รับข้อเสนอ สุด HOT   Mirage  Attrage   Triton   Pajero เลือกรับข้อเสนอโดนๆดอกเบี้ย  หรือประกันภัยชั้น นาน  ปี Tel มิตซูเตชอัมพร ถูกกว่า ดีกว่า ใช้เงินน้อย ออกรถได้จริง เปิดทำการ วันจันทร์  วันอาทิตย์ เวลา    น,0
ขับอัลติสม้า บางทีเจอกะบะกะพริบไฟใร่ตามหลัง หรือบางทีกะบะแข่งกันมาพอเราทำให้ดูมั่งไม่เห็นใครตามมาเลย พอไปเจอเราที่ปั้มมีแอบมองด้วย,2
ส่งเรื่องเข้าศูนย์ฮอนด้าบริษัทใหญ่ที่กรุงเทพก็ไม่มีอะไรตอบกลับมา,2
ส่วนลด  แสน ของ Mazda เหรอครับ,3
รถรุ่น Toyota Ativ โตโยต้าท่าจีนส่งมอบความสุขที่มากกว่า,0
สวัสดีครับ ผมกำลังรอรับรถ mazda  skg  ช่วยแนะนำข้อดี ข้อเสีย ข้อควรระวังของรถรุ้นนี้หน่อยครับ แนะนำการใช้งานรถใหม่ด้วยยิ่งดีเลยครับ,2
ฮอนด้า ชวนสัมผัส ฮอนด้า คลาริตี้ ฟิวเซลล์เทคโนโลยียานยนต์แห่งอนาคต พร้อมปลุกเร้าความสปอร์ตไปกับ ฮอนด้า ซีวิค แฮทช์แบ็ก สีใหม่ แดงแรลลี่ ครั้งแรกในงาน Motorshow httpwwwispeedegazinecomhotnewsmotorshow,0
ดีแมคแค็ฟมีมั้ยคัฟ,0
พวกนิสสัน มาร์ช อัลมีร่ามีเปลี่ยนนะครับ,0
ถ้ามือคนยังไม่นิยมแล้วมือคนยังจะนิยมหรือตอนนิสสันนาวาร่าขื้นมาตืคู่กับโตโยราคาเขาก็ไม่ตกเหมือนกันเขาว่าเป็นรุ่นว่ารุ่นไหนโดนถ้าfordเขาโตนราคาก็ไม่ตกหรอก,0
ก่อนหน้านี้เคยพูดถึงสิ่งที่ Isuzu DMax ควรเพิ่มเติมหรือปรับปรุง ถ้าให้พูดแบบง่ายๆก็คือ ติ นั่นเอง ก่อนหน้านี้ก็เคยกับแบรนด์ยักษ์ใหญ่ญี่ปุ่น  แบรนด์มาแล้ว แบรนด์นึงมีองครักษ์มาหาว่าผมโจมตีโน่นนั่นนี่ แต่อีกแบรนด์ไม่มีเลยและยอมรับจุดตำหนิด้วยซ้ำ และก็เคยมีสมาชิกบอกให้ติแบรนด์สามเพชรบ้าง คราวนี้ผมเลยจัดให้บ้าง ก็ Mitsubishi Triton อย่างที่หลายคนรู้กันดีว่ายอดขายรวมจากเดิมที่เคยอยู่ Top  ในตลาดกระบะ แต่ในช่วงปีสองปีมานี้กลายเป็นว่าแบรนด์อเมริกันอย่าง Ford ขึ้นมาเป็นอันดับ  แทน เรื่องแรกเลยคือหน้าตาที่หลายคนไม่ค่อยจะชอบกัน แต่คนที่ชอบก็มี ยังไม่ยอมปรับโฉมหน้าใหม่แม้จะล่วงเลยเข้าปีที่  แล้ว ไม่อยากให้ยึดตาม Roadmap ของรุ่นเดิมๆว่าต้องปรับนิดๆหน่อยๆหรือไม่ปรับเลยตามแบบรุ่นเก่า เพราะอะไรๆมันก็เปลี่ยนไปตามเวลา คู่แข่งเริ่มมีหลายอย่างน่าสนใจมากขึ้น มันมากพอที่จะมาแย่งส่วนแบ่งยอดขายได้หรือร้ายสุดคือทำให้ตกอันดับลงได้ ฉะนั้นแม้ผมจะไม่ได้ซีเรียสมากเรื่องหน้าตาก็อยากจะให้ปรับโฉมหน้าเหมือนกัน อีกเรื่องก็คือเครื่องยนต์ของรถที่ยังคงกั๊กเครื่องดีเซล Mivec  ลิตร บล็อกล่าสุดไว้แต่รุ่นบนๆ แต่รุ่นล่างๆอย่างกระบะตอนเดียว หรือตัวเตี้ยทั้งหลายยังเป็นเครื่องเก่าอยู่ ส่งผลให้เครื่องเก่าก็ยังได้เกียร์เดิมนั่นคือ ธรรมดา 5 สปีด ส่วนเครื่องใหม่จะได้ ธรรมดา  สปีดแล้ว ถึงเรื่องนี้ไม่ค่อยมีใครคิดมาก แต่ผมว่าต้องมีคนอยากให้เปลี่ยนบ้าง เรื่องสุดท้ายคือระบบความปลอดภัยที่พี่มิตซูเล่นให้แค่เฉพาะตัวท็อป  ประตู เกียร์อัตโนมัติขับเคลื่อน  ล้ออย่างเดียว ทั้งรุ่นธรรมดาและพิเศษ ในขณะที่ค่ายอื่นยังดีที่ให้ในตัวขับเคลื่อน  ล้อบ้าง และอีกอย่างก็คือระบบความปลอดภัยมาตรฐานอย่าง ABS EBD ก็ยังไม่มาครบทุกรุ่นเลย บางคนอาจมองว่าไม่จำเป็นแต่ผมว่ามันจำเป็นมากสำหรับคนอย่างผมเลย ก็มีเพียงเท่านี้ครับหวังว่าทุกท่านจะยอมรับสิ่งที่ผมกล่าวมา,2
นิสสันมาร์ทมีไหมคะ,0
ขอเเจ้งเรื่องการจองรถหน่อยค่ะมีปัญหาเยอะมากไม่เข้าใจว่าท่าmgจัดการยังไงจองร่วงหน้าเป็นเดือนกว่าด้วยซ้ำจน เเจ้งจะเอารถวันไหน เซ็ลรับปากว่าได้เเน่นอนในเดือนที่เราต้องการได้เเน่นอนไม่มีปัญหา เเล้วก็โทรมาเเจ้งว่ารถมาถึงเเล้ว ท่าดิฉันก็เเจ้งล่วงน่าไปก่อนนานเเล้วว่าสะดวกวันที่เท่าไร พอจนถึงวันรับรถเซ็ลไม่เเจ้งไม่โทรมาบอกว่ารถไม่ได้เเล้วให้เราโทรตามเอง ไม่เเจ้งไม่ตามเรื่องอะไรให้เลย แล้ววันที่ทราบว่ารถมาถึงโทร เช็กเข้าไปที่ศูนย์mg สุวินทวงค์ ท่าผู้จัดการบอกมีการเเต่งรถของดิฉันเเล้ว ฉันเลยคิดว่ารถจะได้ตามวันเเน่นอนเเล้วพอถึงวันรับรถบอกไม่มีรถให้ ทำไมถึงการจัดการรับรถมัวขนาดนี้ค่ะ ตัวเซ็ลก็ไม่มีการสนใจตามเรื่องหรือโทรเเจ้งอะไรลูกค้าเลยต้องมีคนโทรถามเองเช็กเองทุกอย่าง,2
ขอรายละเอียดมาสด้าค่ะ ลอตนี้เปนรถปีมั้ยคะ,0
Hyundai H มีไหมครับ,0
ทาทา มอเตอร์ส ส่งคาราวานบุกทั่วประเทศ ให้บริการเข้าถึงลูกค้ามากขึ้น บริษัท ทาทา มอเตอร์ส ประเทศไทย จำกัด ส่ง ทาทา คาราวาน Tata Customer Experience Caravan ลงพื้นที่จัดแสดงรถกระบะทาทาหลากหลายรุ่นในพื้นที่ภาคต่างๆ ทั่วประเทศไทย ล่าสุดได้ส่งทีมคาราวานรถกระบะทาทาไปยังภาคเหนือในจังหวัดเชียงราย เชียงใหม่ และลำปาง หลังจากที่ประสบความสำเร็จในการยกกองคาราวานไปให้บริการลูกค้าในภาคตะวันออกเฉียงเหนือ และได้รับการตอบรับเป็นอย่างดีทั้งในจังหวัดนครราชสีมา บุรีรัมย์ และสุรินทร์ โดยนำรถกระบะ ทาทา ซีนอน แบบซิงเกิลแค็บ ดับเบิ้ลแค็บ และรถกระบะขนาดเล็ก ทาทา ซูเปอร์เอซ มินท์ ไปจัดแสดง ทาทา คาราวาน มีเป้าหมายในการขยายพื้นที่เพื่อเข้าถึงลูกค้าในภาคต่างๆ เพื่อให้ลูกค้าได้รู้จักแบรนด์ ทาทา มอเตอร์ส มากยิ่งขึ้น และได้สัมผัสจุดเด่น ประสิทธิภาพ และสมรรถนะด้านต่างๆ ของรถกระบะทาทา ซึ่งเป็นรถเพื่อการพาณิชย์ที่ตอบสนองความคุ้มค่าคุ้มราคา ประหยัดต้นทุนอย่างแท้จริง นอกจากนี้ลูกค้ายังได้รับประสบการณ์การขับขี่ที่ถูกต้องจากผู้เชี่ยวชาญที่ร่วมเดินทางไปกับคาราวานทาทา โดยมีลูกค้าให้ความสนใจ และสั่งจองรถจากการจัด ทาทา คาราวาน เป็นจำนวนมาก,0
มีบริการทั้งหมด บริการ ครับ ชอบเป็นพิเศษก็คือบริการหลังการขายโดยการรับประกันงานซ่อมถึงหนึ่งปีหรือสองหมื่นกิโลเมตร ทำให้มั่นใจในการบริการหลังการขายที่มีทีมช่างที่มีคุณภาพคอยดูแลและตรวจสอบให้ลูกค้า ทำให้รถนิสสันของเราเหมือนใหม่อยู่ตลอดเวลาครับ NissanTH NISSANSERVICE,1
ฟอร์ดเรนเจอร์mcน่าใช้ปะครับ,0
ผมขอแชร์ในส่วนของ mazda  sky และ  sky ครับ ตัววัดมันเชื่อถือได้เลยผมว่า คลาดเคลื่อนไปนิสเดียส คือมันหลอกว่าขับได้มากกว่าประมาณ km L ครับ ผมวัดเอง เติมกลับ ดก็บผลมาปี ได้ประมาณนี้เลย จอมันโชว์ว่าๆได้ kmL จริงๆมันได้ประมาณkmL งี้ครับ ค่อนข้างเชื่อถือได้เลย ตัวคำนวณมัน,2
ตัดสินใจจะไปเอา Accord hybrid tech  ล แต่ไปลองtest drive BMW e  สรุปเพิ่มเงิน  ส เอา e top  BSI 5 ปี ครับ,0
คำถามคือ CP จะใช้รถตัวเองมั้ย เพราะการขนส่งนี่ใช้น้ำมันเยอะมาก กระบะ MG ถูกออกแบบมาให้ใหญ่ อืดและกินน้ำมัน เน้นอ็อปชั่นอำนวยความสะดวกคนขับ ถ้า CP ต้องจ่ายค่าน้ำมันเพิ่มขึ้น  โดยความสบายของคนขับรถเพิ่ม ผมว่าเค้าไม่เอา ใช้ Revo หรือ Dmax ตัวล่างดีกว่า ต้นทุนรถสูงกว่าแต่ซ่อมบำรุงน้อยกว่าและประหยัดน้ำมันกว่า,0
จริงๆก็ถือว่าแพ้ honda แหละครับ มันรวมยังได้แค่ xx คัน เฉือน ซิตี้ ไปไม่กี่คัน เพราะ honda ยังมี แบ็กเป็น jazz ด้วย,0
สนใจ นิสสัน นาวาร่า my vl ศูนย์ไหนมีรถมั่งครับกรุงเทพปริมณฑล,3
ถ้า มิว เซเว่น มีโปรไหมครับ ถ้าจะเทิรนรถเก่าisuzu hilander,3
D max all new Hi เท่าไหร่ครับ,0
งงว่าทำไม Revo ดาวน์น้อยกว่าเก๋ง,0
เออ รอ แอคคอร์ด ตัวใหม่ จบ,0
มีแววว่าจะไม่ได้ไปนิสสัน,2
ล้างจริงแล้วจ้าาาาาาาาา เห็นจริง เปียกจริง โชว์จริง นิสสันเท่านั้น  งานมี  มีนาคม  เป็นต้นไป ณ ตลาดนัดวัดศรี สอบถามโทร,0
ผมชอบมาสด้าcxครับสวยดีแต่ตอนนี้ขับแจ้ส,1
Vios กะล๊อคอัตโนมัติเลย ถ้าลืมกุญแจในรถงานเข้าเลย,2
นิสสันมารชราคา,0
